Latitude;Longitude;Type;StationID;StationName;MLLW;MLW;MSL;MHW;MHHW;NGVD;NAVD
32.8595;-79.8962;Sub;xTide_3062;Rathall Creek entrance, Wando River, Charleston Harbor, South Carolina Current;0.0;-0.05867;-0.94658;-1.75202;-1.85799;-0.68281;-0.98268
27.5708;-82.6438;Sub;xTide_3063;Rattlesnake Key, 1.1 miles northwest of, Tampa Bay, Florida Current;0.0;-0.11386;-0.35397;-0.58171;-0.66369;-0.18896;-0.48376
27.5533;-82.6883;Sub;xTide_3064;Rattlesnake Key, 3.1 miles west of, Tampa Bay, Florida Current;0.0;-0.10570;-0.34276;-0.56766;-0.64870;-0.17783;-0.47597
55.88;-132.595;Sub;xTide_3065;Ratz Harbor, Prince of Wales Island, Alaska;0.0;-999999;-999999;-999999;-999999;-999999;-999999
53.475;-166.873;Sub;xTide_3066;Raven Bay, Unalaska Island, Alaska;0.0;-999999;-999999;-999999;-999999;-999999;-999999
46.6833;-123.755;Sub;xTide_3067;Raymond, Willapa River, Willapa Bay, Washington;0.0;-999999;-999999;-999999;-999999;-999999;-999999
26.2622;-97.2853;Ref;xTide_3068;Realitos Peninsula, Texas;0.0;-0.01399;-0.08541;-0.15451;-0.16184;0.01208;-0.08856
33.9847;-77.9308;Sub;xTide_3069;Reaves Point Channel (Depth 16ft), Cape Fear River, North Carolina Current;0.0;-0.04510;-0.69140;-1.29272;-1.39071;-0.51495;-0.81132
33.9847;-77.9308;Sub;xTide_3070;Reaves Point Channel (Depth 26ft), Cape Fear River, North Carolina Current;0.0;-0.04510;-0.69140;-1.29272;-1.39071;-0.51495;-0.81132
33.9847;-77.9308;Sub;xTide_3071;Reaves Point Channel (Depth 6ft), Cape Fear River, North Carolina Current;0.0;-0.04510;-0.69140;-1.29272;-1.39071;-0.51495;-0.81132
33.9987;-77.9495;Sub;xTide_3072;Reaves Point, 0.3 mile east of (Depth 16ft), Cape Fear River, North Carolina Current;0.0;-0.04624;-0.68486;-1.29216;-1.38918;-0.48579;-0.79852
33.9987;-77.9495;Sub;xTide_3073;Reaves Point, 0.3 mile east of (Depth 26ft), Cape Fear River, North Carolina Current;0.0;-0.04624;-0.68486;-1.29216;-1.38918;-0.48579;-0.79852
33.9987;-77.9495;Sub;xTide_3074;Reaves Point, 0.3 mile east of (Depth 6ft), Cape Fear River, North Carolina Current;0.0;-0.04624;-0.68486;-1.29216;-1.38918;-0.48579;-0.79852
34.0062;-77.9525;Sub;xTide_3075;Reaves Point, 0.4 mile north of (Depth 16ft), Cape Fear River, North Carolina Current;0.0;-0.04744;-0.68788;-1.29914;-1.39600;-0.48202;-0.80034
34.0062;-77.9525;Sub;xTide_3076;Reaves Point, 0.4 mile north of (Depth 26ft), Cape Fear River, North Carolina Current;0.0;-0.04744;-0.68788;-1.29914;-1.39600;-0.48202;-0.80034
34.0062;-77.9525;Sub;xTide_3077;Reaves Point, 0.4 mile north of (Depth 6ft), Cape Fear River, North Carolina Current;0.0;-0.04744;-0.68788;-1.29914;-1.39600;-0.48202;-0.80034
34.0072;-77.9412;Sub;xTide_3078;Reaves Point, 0.8 mile northeast of (Depth 16ft), Cape Fear River, North Carolina Current;0.0;-0.04684;-0.69150;-1.30216;-1.39864;-0.49092;-0.80446
34.0072;-77.9412;Sub;xTide_3079;Reaves Point, 0.8 mile northeast of (Depth 26ft), Cape Fear River, North Carolina Current;0.0;-0.04684;-0.69150;-1.30216;-1.39864;-0.49092;-0.80446
34.0072;-77.9412;Sub;xTide_3080;Reaves Point, 0.8 mile northeast of (Depth 6ft), Cape Fear River, North Carolina Current;0.0;-0.04684;-0.69150;-1.30216;-1.39864;-0.49092;-0.80446
34.0033;-77.955;Sub;xTide_3081;Reaves Point, Cape Fear River, North Carolina;0.0;-0.04806;-0.68502;-1.29598;-1.39298;-0.47997;-0.79766
32.7663;-79.8733;Sub;xTide_3082;Rebellion Reach, 0.8 n.mi. N. of Ft. Sumter, Charleston Harbor, South Carolina Current;0.0;-0.05653;-0.86035;-1.60959;-1.72077;-0.64546;-0.94671
40.355;-74.065;Sub;xTide_3083;Red Bank, Navesink River, Shrewsbury River, New Jersey;0.0;-999999;-999999;-999999;-999999;-999999;-999999
29.985;-81.63;Sub;xTide_3084;Red Bay Point, draw bridge (Depth 14ft), St. Johns River, Florida Current;0.0;-0.02410;-0.15790;-0.28200;-0.29840;0.14498;-0.16693
29.985;-81.63;Sub;xTide_3085;Red Bay Point, draw bridge (Depth 4ft), St. Johns River, Florida Current;0.0;-0.02410;-0.15790;-0.28200;-0.29840;0.14498;-0.16693
29.985;-81.63;Sub;xTide_3086;Red Bay Point, draw bridge (Depth 6ft), St. Johns River, Florida Current;0.0;-0.02410;-0.15790;-0.28200;-0.29840;0.14498;-0.16693
29.9783;-81.6283;Ref;xTide_3087;Red Bay Point, St. Johns River, Florida;0.0;-0.02600;-0.16400;-0.29000;-0.30500;0.13491;-0.17670
56.8567;-134.723;Ref;xTide_3088;Red Bluff Bay, Baranof Island, Alaska;0.0;-999999;-999999;-999999;-999999;-999999;-999999
67.5767;-164.065;Ref;xTide_3089;Red Dog Dock, Alaska;0.0;-999999;-999999;-999999;-999999;-999999;-999999
39.5292;-75.9847;Sub;xTide_3090;Red Point, 0.2 mile W of, Northeast River (Depth 7ft), Chesapeake Bay, Maryland Current;0.0;-0.09464;-0.37446;-0.66652;-0.79448;-0.11188;-0.34533
59.6117;-139.58;Sub;xTide_3091;Redfield Cove, Yakutat Bay, Alaska;0.0;-999999;-999999;-999999;-999999;-999999;-999999
26.55;-82.1967;Sub;xTide_3092;Redfish Pass, Captiva Island (north end), Florida;0.0;-0.12570;-0.34652;-0.56036;-0.63730;-0.17313;-0.53000
27.5267;-82.4817;Sub;xTide_3093;Redfish Point, Manatee River, Florida;0.0;-0.10300;-0.37100;-0.62300;-0.69600;-0.15226;-0.44902
58.4533;-152.595;Sub;xTide_3094;Redfox Bay, Shuyak Strait, Alaska;0.0;-999999;-999999;-999999;-999999;-999999;-999999
18.3267;-64.8517;Sub;xTide_3095;Redhook Bay, St. Thomas, Virgin Islands;0.0;-0.03944;-0.15830;-0.28766;-0.33250;-999999;-0.23880
37.5067;-122.21;Ref;xTide_3096;Redwood City, Wharf 5, San Francisco Bay, California;0.0;-0.36600;-1.34203;-2.30803;-2.50103;-1.12885;-0.30829
37.5167;-122.2;Sub;xTide_3097;Redwood Creek entrance (inside), San Francisco Bay, California;0.0;-0.36837;-1.33972;-2.30572;-2.49849;-1.12119;-0.30293
37.5333;-122.193;Ref;xTide_3098;Redwood Creek Marker 8, San Francisco Bay, California;0.0;-0.36860;-1.32816;-2.28611;-2.47864;-1.10419;-0.28721
37.5333;-122.193;Sub;xTide_3099;Redwood Creek Marker 8, San Francisco Bay, California (sub);0.0;-0.36860;-1.32816;-2.28611;-2.47864;-1.10419;-0.28721
43.7083;-124.098;Sub;xTide_3100;Reedsport, Umpqua River, Oregon;0.0;-0.39907;-1.37868;-2.41365;-2.62605;-1.37231;-0.27951
39.5583;-75.5733;Ref;xTide_3101;Reedy Point, C&D Canal, Delaware;0.0;-0.05483;-0.88553;-1.68013;-1.77949;-0.61973;-0.90040
54.1307;-166.0993;Ref;xTide_3102;Reef Bight, Alaska;0.0;-999999;-999999;-999999;-999999;-999999;-999999
56.3533;-132.553;Ref;xTide_3103;Reef Point, Stikine Strait, Alaska;0.0;-999999;-999999;-999999;-999999;-999999;-999999
38.72;-75.0833;Sub;xTide_3104;Rehoboth Beach, Delaware;0.0;-999999;-999999;-999999;-999999;-999999;-999999
56.3883;-133.883;Sub;xTide_3105;Reid Bay, Alaska;0.0;-999999;-999999;-999999;-999999;-999999;-999999
32.8162;-79.9095;Sub;xTide_3106;Remley Point, 0.2 mile northwest of, Wando River, South Carolina Current;0.0;-0.05671;-0.91418;-1.68880;-1.79764;-0.66542;-0.96546
37.4967;-75.6833;Sub;xTide_3107;Revel Island, Revel Creek, Virginia;0.0;-999999;-999999;-999999;-999999;-999999;-999999
38.1467;-122.883;Sub;xTide_3108;Reynolds, Tomales Bay, California;0.0;-0.28997;-0.83797;-1.42700;-1.64897;-0.69687;0.11970
33.6033;-79.4267;Sub;xTide_3109;Rhems, Black Mingo Creek, Black River, Great Pee Dee River, South Carolina;0.0;-999999;-999999;-999999;-999999;-999999;-999999
38.8867;-76.54;Sub;xTide_3110;Rhode River (County Wharf), Chesapeake Bay, Maryland;0.0;-0.06688;-0.21298;-0.36557;-0.45573;0.00100;-0.24709
29.69;-85.3633;Ref;xTide_3111;Richardson Hammock, St. Joseph Bay, Florida;0.0;-0.04624;-0.25276;-0.43501;-0.52110;0.00673;-0.13912
48.4467;-122.9;Ref;xTide_3112;Richardson, Lopez Island, San Juan Channel, Washington;0.0;-0.63703;-1.31303;-2.02301;-2.18503;-1.17796;-0.03333
37.4596;-77.4208;Ref;xTide_3113;Richmond Deepwater Terminal, James River, Virginia;0.0;-0.04910;-0.53837;-0.99409;-1.07454;-0.11778;-0.43500
37.91;-122.358;Sub;xTide_3114;Richmond Inner Harbor, San Francisco Bay, California;0.0;-0.34200;-0.99000;-1.65200;-1.84100;-0.81220;-0.00201
33.0767;-79.855;Sub;xTide_3115;Richmond Plantation, East Branch, Cooper River, South Carolina;0.0;-0.07797;-0.51999;-0.89098;-0.95201;0.13627;-0.16428
37.525;-77.42;Ref;xTide_3116;Richmond River Locks, James River, Virginia;0.0;-0.06084;-0.54904;-1.03569;-1.12763;-0.19602;-0.51121
44.0883;-69.7983;Ref;xTide_3117;Richmond, Kennebec River, Maine;0.0;-999999;-999999;-999999;-999999;-999999;-999999
40.85;-74.03;Sub;xTide_3118;Ridgefield Park, Hackensack River, New Jersey;0.0;-999999;-999999;-999999;-999999;-999999;-999999
39.2;-74.97;Sub;xTide_3119;Riggins Ditch, 0.5 n.mi. above entrance, Delaware Bay, New Jersey;0.0;-999999;-999999;-999999;-999999;-999999;-999999
39.2183;-74.98;Sub;xTide_3120;Riggins Ditch, Heislerville, Delaware Bay, New Jersey;0.0;-999999;-999999;-999999;-999999;-999999;-999999
40.7833;-73.8833;Sub;xTide_3121;Rikers I. chan., off La Guardia Field, East River, New York Current;0.0;-0.08540;-1.04756;-2.02532;-2.13302;-0.76319;-1.09388
34.3483;-119.443;Sub;xTide_3122;Rincon Island, Mussel Shoals, California;0.0;-0.30060;-0.86070;-1.43390;-1.66340;-0.81512;-0.03019
37.79;-122.387;Ref;xTide_3123;Rincon Point, Pier 22½, San Francisco Bay, California;0.0;-0.34100;-0.99500;-1.71700;-1.90800;-0.83610;-0.00600
38.145;-121.692;Ref;xTide_3124;Rio Vista, Sacramento River, California;0.0;-0.17900;-0.64900;-1.09800;-1.24300;-0.12257;0.61701
59.885;-141.457;Sub;xTide_3125;Riou Bay, Alaska;0.0;-999999;-999999;-999999;-999999;-999999;-999999
39.3683;-74.7167;Sub;xTide_3126;River Bend Marina, Great Egg Harbor River, New Jersey;0.0;-999999;-999999;-999999;-999999;-999999;-999999
40.9033;-73.9167;Ref;xTide_3127;Riverdale, Hudson River, New York;0.0;-0.06088;-0.64912;-1.23674;-1.32859;-0.32688;-0.64285
40.9033;-73.9167;Sub;xTide_3128;Riverdale, Hudson River, New York (sub);0.0;-0.06088;-0.64912;-1.23674;-1.32859;-0.32688;-0.64285
42.7633;-71.0767;Ref;xTide_3129;Riverside, Merrimack River, Massachusetts;0.0;-999999;-999999;-999999;-999999;-999999;-999999
38.3867;-77.145;Sub;xTide_3130;Riverside, Potomac River, Maryland;0.0;-0.02418;-0.22466;-0.42329;-0.45344;0.02970;-0.21402
40.0967;-74.0867;Sub;xTide_3131;Riviera Beach, Manasquan River, New Jersey;0.0;-999999;-999999;-999999;-999999;-999999;-999999
24.565;-81.7517;Sub;xTide_3132;Riviera Canal, Key West, Florida;0.0;-0.04503;-0.18201;-0.30098;-0.38801;-0.00914;-0.41961
37.4467;-76.7083;Sub;xTide_3133;Roane Point, York River, Virginia;0.0;-0.03059;-0.46512;-0.88371;-0.94480;-0.17474;-0.55415
35.8117;-75.7;Ref;xTide_3134;Roanoke Marshes Light, outer coast, North Carolina;0.0;-0.03200;-0.09300;-0.15500;-0.18100;0.18876;-0.12030
35.7983;-75.5833;Sub;xTide_3135;Roanoke Sound Channel, North Carolina;0.0;-0.03180;-0.11698;-0.20265;-0.23609;0.13677;-0.17100
38.2617;-75.92;Sub;xTide_3136;Roaring Point, Nanticoke River, Maryland;0.0;-0.04386;-0.36242;-0.68677;-0.71975;-0.18462;-0.43590
37.6667;-122.2;Sub;xTide_3137;Roberts Landing, 1.3 miles west of, San Francisco Bay, California;0.0;-0.35469;-1.20523;-2.08865;-2.28268;-0.99650;-0.18038
43.8533;-69.7333;Sub;xTide_3138;Robinhood, Sasanoa River, Sheepscot River, Maine;0.0;-0.10610;-1.50882;-2.88641;-3.01650;-1.33669;-1.54628
39.2958;-76.2683;Sub;xTide_3139;Robins Point, 0.7 mile ESE of (Depth 5ft), Chesapeake Bay, Maryland Current;0.0;-0.06269;-0.24263;-0.40284;-0.50160;-0.01013;-0.25828
41.435;-70.78;Sub;xTide_3140;Robinsons Hole, 1.2 miles southeast of, Vineyard Sound, Massachusetts Current;0.0;-0.03731;-0.34684;-0.73574;-0.81287;-0.18419;-0.44644
48.61;-123.155;Sub;xTide_3141;Roche Harbor, San Juan Island, Haro Strait, Washington;0.0;-0.66478;-1.40311;-2.14439;-2.31346;-1.30457;-0.14530
25.0817;-80.4467;Sub;xTide_3142;Rock Harbor, Key Largo, Florida;0.0;-0.06208;-0.38874;-0.70687;-0.73965;-0.17599;-0.65316
29.9667;-83.8333;Sub;xTide_3143;Rock Islands, Florida;0.0;-0.17823;-0.56951;-1.00629;-1.08330;-0.32368;-0.52555
31.3739;-81.3339;Ref;xTide_3144;Rockdedundy River (Daymark 185), Georgia;0.0;-0.06599;-1.16998;-2.17900;-2.29101;-0.98702;-1.28783
24.5917;-81.67;Sub;xTide_3145;Rockland Key, Rockland Channel Bridge, Florida;0.0;-0.05560;-0.23560;-0.45850;-0.54070;-0.01835;-0.43279
44.105;-69.1017;Ref;xTide_3146;Rockland, Penobscot River, Maine;0.0;-0.11898;-1.62400;-3.09998;-3.22300;-1.53730;-1.74727
42.6583;-70.615;Ref;xTide_3147;Rockport Harbor, Massachusetts;0.0;-0.09918;-1.43648;-2.75190;-2.88301;-1.28588;-1.52940
28.0217;-97.0467;Ref;xTide_3148;Rockport, Aransas Bay, Texas;0.0;-0.00101;-0.05900;-0.11001;-0.11101;0.41828;0.28171
32.5983;-80.195;Sub;xTide_3149;Rockville, Bohicket Creek, North Edisto River, South Carolina;0.0;-0.06309;-0.99291;-1.80193;-1.91337;-0.76075;-1.05839
41.6633;-72.63;Sub;xTide_3150;Rocky Hill, Connecticut River, Connecticut;0.0;-999999;-999999;-999999;-999999;-999999;-999999
47.0817;-123.005;Sub;xTide_3151;Rocky Point, Eld Inlet, Puget Sound, Washington;0.0;-0.93330;-2.49155;-4.04671;-4.33481;-2.23716;-1.19918
45.6967;-122.868;Ref;xTide_3152;Rocky Point, Multnomah Channel, Oregon;0.0;-0.07300;-0.43100;-0.84200;-1.02200;0.83163;1.85038
60.9467;-146.755;Sub;xTide_3153;Rocky Point, Valdez Arm, Alaska;0.0;-999999;-999999;-999999;-999999;-999999;-999999
39.4883;-75.9975;Sub;xTide_3154;Rocky Pt. (Elk Neck), 0.25 n.mi. SW of (Depth 9ft), Chesapeake Bay, Maryland Current;0.0;-0.08131;-0.35296;-0.63148;-0.74899;-0.10209;-0.33263
35.595;-75.4717;Sub;xTide_3155;Rodanthe, Pamlico Sound, North Carolina;0.0;-0.02600;-0.13100;-0.24600;-0.29900;0.17700;-0.13920
29.515;-94.5133;Ref;xTide_3156;Rollover Pass, Texas;0.0;-0.04704;-0.22532;-0.38169;-0.40762;-0.03928;-0.04028
31.9333;-81;Sub;xTide_3157;Romerly Marsh Creek, Georgia;0.0;-999999;-999999;-999999;-999999;-999999;-999999
11.15;-166.9;Sub;xTide_3158;Rongelap Island, Rongelap Atoll, Marshall Islands;0.0;-999999;-999999;-999999;-999999;-999999;-999999
11.3833;-167.5167;Sub;xTide_3159;Rongerik Atoll, Marshall Islands;0.0;-999999;-999999;-999999;-999999;-999999;-999999
40.7582;-73.9513;Sub;xTide_3160;Roosevelt Island, east of, East River, New York Current;0.0;-0.05966;-0.67351;-1.39870;-1.49590;-0.39427;-0.72624
40.7667;-73.95;Sub;xTide_3161;Roosevelt Island, east of, off 36th Avenue, East River, New York Current;0.0;-0.08723;-0.70664;-1.56495;-1.66020;-0.41645;-0.74790
40.7597;-73.9545;Sub;xTide_3162;Roosevelt Island, west of, off 63rd Street, East River, New York Current;0.0;-0.05884;-0.67457;-1.41098;-1.50782;-0.39780;-0.72953
40.7623;-73.954;Sub;xTide_3163;Roosevelt Island, west of, off 67th Street, East River, New York Current;0.0;-0.06015;-0.65167;-1.41252;-1.50846;-0.37153;-0.70309
40.7667;-73.95;Sub;xTide_3164;Roosevelt Island, west of, off 75th Street, East River, New York Current;0.0;-0.08723;-0.70664;-1.56495;-1.66020;-0.41645;-0.74790
18.2333;-65.6167;Sub;xTide_3165;Roosevelt Roads, Puerto Rico;0.0;-999999;-999999;-999999;-999999;-999999;-999999
54.0522;-165.5142;Ref;xTide_3166;Rootok Island, Rootok Strait, Alaska;0.0;-999999;-999999;-999999;-999999;-999999;-999999
48.4583;-122.7833;Ref;xTide_3167;Rosario Strait, Washington Current;0.0;-0.66942;-1.41635;-2.14577;-2.32359;-1.26109;-0.11016
48.6467;-122.87;Sub;xTide_3168;Rosario, East Sound, Orcas Island, Washington;0.0;-0.76119;-1.48766;-2.25456;-2.46642;-1.36197;-0.18700
38.725;-76.5417;Sub;xTide_3169;Rose Haven, Chesapeake Bay, Maryland;0.0;-0.06170;-0.20980;-0.35715;-0.42490;-0.02239;-0.26346
41.5033;-71.3317;Sub;xTide_3170;Rose Island, northeast of (Depth 15ft), Narragansett Bay, Rhode Island Current;0.0;-0.04323;-0.53638;-1.10598;-1.18119;-0.36012;-0.62970
41.5067;-71.3517;Sub;xTide_3171;Rose Island, northwest of (Depth 15ft), Narragansett Bay, Rhode Island Current;0.0;-0.04390;-0.54255;-1.11269;-1.18804;-0.36620;-0.63721
41.4967;-71.35;Sub;xTide_3172;Rose Island, west of, Narragansett Bay, Rhode Island Current;0.0;-0.04346;-0.53518;-1.09335;-1.16821;-0.35713;-0.62818
30.7033;-81.5767;Sub;xTide_3173;Roses Bluff, Bells River, Florida;0.0;-0.05602;-1.05497;-1.94192;-2.04687;-0.83844;-1.18423
40.5567;-74.2233;Sub;xTide_3174;Rossville, Arthur Kill, New York;0.0;-0.08487;-0.88142;-1.67620;-1.78021;-0.59506;-0.91309
14.1333;-145.1333;Sub;xTide_3175;Rota Island, Marianas;0.0;-999999;-999999;-999999;-999999;-999999;-999999
41.5383;-70.9283;Ref;xTide_3176;Round Hill Point, Buzzards Bay, Massachusetts;0.0;-0.04102;-0.50985;-1.08719;-1.16905;-0.35167;-0.60234
25.8333;-81.5333;Sub;xTide_3177;Round Key, Florida;0.0;-0.18697;-0.66076;-1.13596;-1.21270;-0.45311;-0.86403
29.7133;-94.69;Ref;xTide_3178;Round Point, Trinity Bay, Galveston Bay, Texas;0.0;-0.05500;-0.23100;-0.39800;-0.42600;-0.02347;-0.02503
41.065;-73.445;Sub;xTide_3179;Rowayton, Fivemile River, Connecticut;0.0;-0.07780;-1.16369;-2.23988;-2.34496;-0.88081;-1.21967
32.5217;-80.8383;Sub;xTide_3180;RR. Bridge, Hall Island, Broad River, South Carolina;0.0;-0.06412;-1.44509;-2.50542;-2.61897;-1.13944;-1.42228
32.2367;-81.0117;Sub;xTide_3181;Rt. 170 bridge, New River, South Carolina;0.0;-0.10500;-0.75242;-1.12095;-1.15505;-0.14223;-0.42188
36.825;-75.975;Sub;xTide_3182;Rudee Heights, Lake Wesley, Virginia;0.0;-999999;-999999;-999999;-999999;-999999;-999999
36.8317;-75.9683;Sub;xTide_3183;Rudee Inlet entrance, Virginia;0.0;-0.03733;-0.55164;-1.03998;-1.12616;-0.49968;-0.75388
55.6417;-130.645;Sub;xTide_3184;Rudyerd Bay, Alaska;0.0;-999999;-999999;-999999;-999999;-999999;-999999
56.0667;-133.75;Sub;xTide_3185;Ruins Point, 2 miles west of, Sumner Strait, Alaska Current;0.0;-999999;-999999;-999999;-999999;-999999;-999999
41.84;-71.3733;Sub;xTide_3186;Rumford, Seekonk River, Narragansett Bay, Rhode Island;0.0;-999999;-999999;-999999;-999999;-999999;-999999
40.9617;-73.6717;Ref;xTide_3187;Rye Beach (Amusement Park), New York;0.0;-0.07316;-1.18919;-2.29548;-2.40563;-0.91826;-1.25586
31.6245;-81.2167;Sub;xTide_3188;S. Newport River, above Swain River Ent (Depth 10ft), Georgia Current;0.0;-0.06430;-1.17975;-2.19875;-2.30785;-0.95430;-1.25963
31.6503;-81.302;Sub;xTide_3189;S. Newport River, below S. Newport Cut (Depth 10ft), Georgia Current;0.0;-999999;-999999;-999999;-999999;-999999;-999999
32.7955;-79.9733;Sub;xTide_3190;S.C.L. RR. bridge, 0.1 mile below, Ashley River, South Carolina Current;0.0;-0.05912;-0.92366;-1.69192;-1.79928;-0.68588;-0.98385
32.82;-79.965;Sub;xTide_3191;S.C.L. RR. bridge, 1.5 miles above, Ashley River, South Carolina Current;0.0;-0.05970;-0.94500;-1.72270;-1.82870;-0.71003;-1.00931
32.2317;-81.145;Sub;xTide_3192;S.C.L. RR. bridge, Savannah River, Georgia;0.0;-0.05033;-1.11634;-2.00056;-2.08066;-0.29413;-0.57490
29.4983;-93.64;Ref;xTide_3193;Sabine (offshore), Texas;0.0;-0.18690;-0.39453;-0.63113;-0.68246;-0.27714;-0.27109
29.8667;-93.93;Ref;xTide_3194;Sabine Naches Canal, Port Arthur, Texas;0.0;-0.04836;-0.18352;-0.30040;-0.31740;0.05689;0.07086
29.7284;-93.8701;Ref;xTide_3195;Sabine Pass (north), Texas;0.0;-0.12412;-0.29260;-0.45617;-0.48708;0.11971;0.13003
41.245;-72.7083;Sub;xTide_3196;Sachem Head, Connecticut;0.0;-0.06948;-0.89059;-1.72078;-1.81589;-0.67558;-0.98555
41.4867;-71.2383;Sub;xTide_3197;Sachuest, Flint Point, Sakonnet River, Rhode Island;0.0;-0.03988;-0.47522;-0.99274;-1.06437;-0.30534;-0.56678
38.58;-121.507;Sub;xTide_3198;Sacramento, Sacramento River, California;0.0;-999999;-999999;-999999;-999999;-999999;-999999
24.6233;-81.6033;Sub;xTide_3199;Saddlebunch Keys, Channel No. 3, Florida;0.0;-0.01405;-0.08702;-0.19804;-0.27800;0.19279;-0.22090
24.615;-81.6167;Sub;xTide_3200;Saddlebunch Keys, Channel No. 4, Florida;0.0;-0.02207;-0.10810;-0.24800;-0.32609;0.15673;-0.25698
24.6117;-81.6233;Sub;xTide_3201;Saddlebunch Keys, Channel No. 5, Florida;0.0;-0.08003;-0.19709;-0.30619;-0.38821;0.11668;-0.29715
24.6;-81.6217;Sub;xTide_3202;Saddlebunch Keys, Similar Sound, Florida;0.0;-0.01403;-0.09804;-0.16807;-0.23703;0.17677;-0.23702
59.49;-151.365;Sub;xTide_3203;Sadie Cove, Kachemak Bay, Cook Inlet, Alaska;0.0;-999999;-999999;-999999;-999999;-999999;-999999
27.9883;-82.685;Ref;xTide_3204;Safety Harbor, Old Tampa Bay, Florida;0.0;-0.16100;-0.45200;-0.74400;-0.85000;-0.27619;-0.53644
41.0033;-72.2967;Ref;xTide_3205;Sag Harbor, Shelter Island Sound, New York;0.0;-0.05504;-0.42962;-0.77151;-0.86101;-0.25521;-0.53714
52.0267;-174.48;Sub;xTide_3206;Sagchudak Island, Atka Island, Alaska;0.0;-999999;-999999;-999999;-999999;-999999;-999999
56.9033;-134.3031;Ref;xTide_3207;Saginaw Bay, Kuiu Island, Frederick Sound, Alaska;0.0;-999999;-999999;-999999;-999999;-999999;-999999
45.865;-122.797;Ref;xTide_3208;Saint Helens, Columbia River, Oregon;0.0;-0.07600;-0.46000;-0.85000;-1.00700;0.87141;1.86800
15.2;-145.7167;Sub;xTide_3209;Saipan Harbor, Saipan Island, Marianas;0.0;-999999;-999999;-999999;-999999;-999999;-999999
55.0667;-133.2;Sub;xTide_3210;Sakie Bay, Dall Island, Alaska;0.0;-999999;-999999;-999999;-999999;-999999;-999999
41.465;-71.1933;Ref;xTide_3211;Sakonnet, Sakonnet River, Rhode Island;0.0;-0.03602;-0.48882;-1.00262;-1.08155;-0.38762;-0.59468
39.6833;-75.51;Sub;xTide_3212;Salem Canal entrance, Delaware River, New Jersey;0.0;-0.05549;-0.89394;-1.73302;-1.84971;-0.58565;-0.87207
42.5233;-70.8767;Ref;xTide_3213;Salem, Salem Harbor, Massachusetts;0.0;-0.10000;-1.47690;-2.82190;-2.95590;-1.32411;-1.57131
39.5767;-75.4767;Sub;xTide_3214;Salem, Salem River, New Jersey;0.0;-999999;-999999;-999999;-999999;-999999;-999999
42.8383;-70.9083;Ref;xTide_3215;Salisbury Point, Merrimack River, Massachusetts;0.0;-0.05813;-1.22988;-2.39272;-2.53092;-0.95836;-1.19604
38.365;-75.6067;Sub;xTide_3216;Salisbury, Wicomico River, Maryland;0.0;-999999;-999999;-999999;-999999;-999999;-999999
43.1917;-70.825;Sub;xTide_3217;Salmon Falls River, Piscataqua River, New Hampshire;0.0;-999999;-999999;-999999;-999999;-999999;-999999
55.4017;-132.328;Sub;xTide_3218;Saltery Cove, Skowl Arm, Kasaan Bay, Alaska;0.0;-999999;-999999;-999999;-999999;-999999;-999999
55.1817;-132.795;Sub;xTide_3219;Saltery Point, Tlevak Strait, Alaska;0.0;-999999;-999999;-999999;-999999;-999999;-999999
40.8267;-124.18;Ref;xTide_3220;Samoa, Humboldt Bay, California;0.0;-999999;-999999;-999999;-999999;-999999;-999999
33.3513;-79.2803;Sub;xTide_3221;Sampit River entrance, Winyah Bay, South Carolina Current;0.0;-0.03583;-0.57272;-1.09143;-1.17407;-0.23652;-0.54263
32.6167;-80.3867;Sub;xTide_3222;Sampson Island, NE end, South Edisto River (Depth 15ft), South Carolina Current;0.0;-0.06663;-1.12546;-1.98481;-2.08556;-0.79456;-1.08551
32.5633;-80.3917;Sub;xTide_3223;Sampson Island, S end, South Edisto River (Depth 15ft), South Carolina Current;0.0;-0.06669;-1.11166;-1.97879;-2.08284;-0.83418;-1.12171
32.4833;-80.6;Sub;xTide_3224;Sams Point, Lucy Point Creek, Coosaw River, South Carolina;0.0;-0.06804;-1.20504;-2.09605;-2.20501;-0.96431;-1.24579
32.4933;-80.5933;Sub;xTide_3225;Sams Point, Northwest of, Coosaw River (Depth 10ft), South Carolina Current;0.0;-0.06670;-1.19758;-2.12171;-2.23261;-0.94920;-1.23038
33.4167;-117.6167;Sub;xTide_3226;San Clemente, California;0.0;-0.27344;-0.82807;-1.39054;-1.61947;-0.73610;-0.04489
32.6817;-117.23;Ref;xTide_3227;San Diego Bay Entrance, California Current;0.0;-0.26653;-0.85176;-1.43688;-1.66125;-0.72574;-0.08362
32.7167;-117.1833;Sub;xTide_3228;San Diego, 0.5 mile west of, San Diego Bay, California Current;0.0;-0.26689;-0.87992;-1.49401;-1.71619;-0.74886;-0.11493
32.7033;-117.235;Sub;xTide_3229;San Diego, Quarantine Station, California;0.0;-0.27302;-0.88162;-1.46274;-1.70434;-0.75681;-0.11411
32.7142;-117.1736;Ref;xTide_3230;San Diego, San Diego Bay, California;0.0;-0.28238;-0.89390;-1.51606;-1.74143;-0.76604;-0.13090
37.7667;-122.6333;Sub;xTide_3231;San Francisco Bar, California;0.0;-0.34710;-0.95397;-1.58019;-1.78509;-0.81322;0.00689
37.8067;-122.465;Ref;xTide_3232;San Francisco, San Francisco Bay, California;0.0;-0.34600;-0.95103;-1.59404;-1.78004;-0.81163;0.01827
29.76;-95.09;Ref;xTide_3233;San Jacinto Battleground State Historic Site, Texas;0.0;-0.05300;-0.24290;-0.41810;-0.44650;0.01369;0.01623
48.4613;-122.9508;Ref;xTide_3234;San Juan Channel (south entrance), Washington Current;0.0;-0.60181;-1.35183;-2.06776;-2.22185;-1.22460;-0.07942
18.4589;-66.1164;Ref;xTide_3235;San Juan, La Puntilla, San Juan Bay, Puerto Rico;0.0;-0.06270;-0.23384;-0.40044;-0.48017;-999999;-0.23384
37.7483;-122.235;Sub;xTide_3236;San Leandro Channel, San Leandro Bay, San Francisco Bay, California;0.0;-0.34347;-1.07799;-1.86656;-2.05716;-0.89791;-0.07694
37.695;-122.192;Ref;xTide_3237;San Leandro Marina, San Francisco Bay, California;0.0;-0.35500;-1.19400;-2.06900;-2.26400;-1.00389;-0.18701
29.095;-95.1133;Ref;xTide_3238;San Luis Pass (TCOON), Texas;0.0;-0.01411;-0.17577;-0.29518;-0.31405;0.01844;0.02081
25.7933;-80.1633;Sub;xTide_3239;San Marino Island, Biscayne Bay, Florida;0.0;-0.03932;-0.36954;-0.71078;-0.73083;-0.17199;-0.64423
37.6083;-122.182;Sub;xTide_3240;San Mateo Bridge (east end), San Francisco Bay, California;0.0;-0.36424;-1.27006;-2.18905;-2.38228;-1.01914;-0.20306
37.58;-122.253;Ref;xTide_3241;San Mateo Bridge (west end), San Francisco Bay, California;0.0;-0.36050;-1.24730;-2.15340;-2.34730;-1.08120;-0.26480
33.2667;-119.497;Sub;xTide_3242;San Nicolas Island, California;0.0;-0.27410;-0.76661;-1.28713;-1.50219;-0.70517;0.04295
35.6417;-121.188;Sub;xTide_3243;San Simeon, California;0.0;-0.32200;-0.84000;-1.38100;-1.59800;-0.76356;0.06785
54.4817;-162.812;Sub;xTide_3244;Sanak Harbor, Sanak Islands, Alaska;0.0;-999999;-999999;-999999;-999999;-999999;-999999
55.155;-159.995;Sub;xTide_3245;Sanborn Harbor, Nagai Island, Shumagin Islands, Alaska;0.0;-999999;-999999;-999999;-999999;-999999;-999999
51.9733;-176.085;Sub;xTide_3246;Sand Bay, Great Sitkin Island, Aleutian Islands, Alaska;0.0;-999999;-999999;-999999;-999999;-999999;-999999
46.2578;-123.9945;Sub;xTide_3247;Sand Island Tower, 0.9nm SE of (north channel) (Depth 15ft), Washington Current;0.0;-0.41458;-1.38121;-2.35288;-2.57312;-1.16610;-0.11996
46.2528;-123.9908;Sub;xTide_3248;Sand Island Tower, 1nm SE of (midchannel) (Depth 15ft), Washington Current;0.0;-0.41555;-1.38288;-2.36158;-2.58059;-1.16378;-0.11603
28.2117;-177.36;Ref;xTide_3249;Sand Island, Midway Islands;0.0;-999999;-999999;-999999;-999999;-999999;-999999
46.2555;-123.968;Sub;xTide_3250;Sand Island, SSE of (Depth 12ft), Washington Current;0.0;-0.41020;-1.37900;-2.36115;-2.57865;-1.12565;-0.08743
