Latitude;Longitude;Type;StationID;StationName;MLLW;MLW;MSL;MHW;MHHW;NGVD;NAVD
57.5167;-134.7;Sub;xTide_0949;Danger Point Light, 3 miles west of, Chatham Strait, Alaska Current;0.0;-999999;-999999;-999999;-999999;-999999;-999999
32.8483;-79.9292;Sub;xTide_0950;Daniel Island Bend, Cooper River, Charleston Harbor, South Carolina Current;0.0;-0.05723;-0.92956;-1.68833;-1.79337;-0.63855;-0.94157
32.8272;-79.9288;Sub;xTide_0951;Daniel Island Reach, Buoy '48', Cooper River, Charleston Harbor, South Carolina Current;0.0;-0.05772;-0.92920;-1.70214;-1.80960;-0.66078;-0.96177
32.8328;-79.93;Sub;xTide_0952;Daniel Island Reach, Cooper River, Charleston Harbor, South Carolina Current;0.0;-0.05792;-0.93136;-1.70130;-1.80812;-0.65663;-0.95813
31.3683;-81.435;Sub;xTide_0953;Darien, Darien River, Georgia;0.0;-999999;-999999;-999999;-999999;-999999;-999999
32.1017;-80.8983;Sub;xTide_0954;Daufuskie Landing Light, south of (Depth 10ft), South Carolina Current;0.0;-0.06390;-1.20833;-2.19844;-2.31134;-0.98092;-1.26179
32.1033;-80.895;Sub;xTide_0955;Daufuskie Landing, Daufuskie Island, New River, South Carolina;0.0;-0.06393;-1.21396;-2.20297;-2.31600;-0.99423;-1.27516
30.2513;-88.0795;Ref;xTide_0956;Dauphin Island Hydro, Alabama;0.0;-0.00303;-0.17210;-0.36110;-0.36714;-0.05250;-0.06781
30.25;-88.075;Ref;xTide_0957;Dauphin Island, Mobile Bay, Alabama;0.0;-0.00300;-0.17200;-0.36100;-0.36700;-0.05489;-0.07001
27.9083;-82.4517;Sub;xTide_0958;Davis Island, Hillsborough Bay, Florida;0.0;-0.14240;-0.43100;-0.69951;-0.80010;-0.26044;-0.52290
55.76;-130.177;Sub;xTide_0959;Davis River entrance, Alaska;0.0;-999999;-999999;-999999;-999999;-999999;-999999
35.7483;-75.5533;Sub;xTide_0960;Davis Slough, North Carolina;0.0;-0.03122;-0.20090;-0.37329;-0.42543;0.03442;-0.27730
38.0117;-121.638;Sub;xTide_0961;Davis Slough, San Joaquin River, California;0.0;-999999;-999999;-999999;-999999;-999999;-999999
34.7968;-76.4555;Ref;xTide_0962;Davis, Core Sound, North Carolina;0.0;-0.02800;-0.19300;-0.35900;-0.40500;0.04007;-0.26724
32.6367;-80.3417;Sub;xTide_0963;Dawho Bridge, Dawho River, North Edisto River, South Carolina;0.0;-0.06402;-1.11301;-1.94301;-2.04899;-0.81566;-1.10705
32.6567;-80.3917;Sub;xTide_0964;Dawho River, South Edisto River, South Carolina;0.0;-0.06500;-1.13613;-1.93934;-2.02437;-0.76359;-1.05382
32.3017;-80.725;Sub;xTide_0965;Daws Island, SE of, Broad River (Depth 15ft), Port Royal Sound, South Carolina Current;0.0;-0.06253;-1.24732;-2.22952;-2.34475;-1.01611;-1.29870
32.2867;-80.7433;Sub;xTide_0966;Daws Island, south of, Chechessee River (Depth 15ft), South Carolina Current;0.0;-0.06208;-1.24613;-2.22672;-2.33921;-1.01712;-1.29917
60.01;-149.062;Sub;xTide_0967;Day Harbor, Alaska;0.0;-999999;-999999;-999999;-999999;-999999;-999999
29.2283;-81.005;Ref;xTide_0968;Daytona Beach (ocean), Florida;0.0;-0.04907;-0.65303;-1.26026;-1.37196;-0.51365;-0.87195
29.1467;-80.9633;Sub;xTide_0969;Daytona Beach Shores, Sunglow Pier, Florida;0.0;-0.04700;-0.63100;-1.23700;-1.35000;-0.50666;-0.87268
48.4125;-122.7395;Sub;xTide_0970;Deception Island, 2.7 miles west of, Rosario Strait, Washington Current;0.0;-0.71078;-1.40719;-2.11621;-2.31171;-1.23891;-0.09087
48.4062;-122.643;Ref;xTide_0971;Deception Pass (narrows), Washington Current;0.0;-0.77894;-1.64485;-2.55804;-2.80362;-1.45520;-0.30472
48.415;-122.652;Sub;xTide_0972;Deception Pass St. Park, Bowman Bay, Fidalgo I., Washington;0.0;-0.74589;-1.40944;-2.15288;-2.35074;-1.22227;-0.07179
36.755;-76.2933;Sub;xTide_0973;Deep Creek Entrance, Elizabeth River, Virginia;0.0;-0.04480;-0.49036;-0.93291;-0.99888;-0.29713;-0.55147
40.6033;-73.525;Sub;xTide_0974;Deep Creek Meadow, Hempstead Bay, New York;0.0;-0.03891;-0.60241;-1.17077;-1.26032;-0.30265;-0.64840
39.145;-76.26;Sub;xTide_0975;Deep Landing, Swan Creek, Chesapeake Bay, Maryland;0.0;-0.06650;-0.24985;-0.42675;-0.51735;-0.04546;-0.29362
38.7317;-76.235;Sub;xTide_0976;Deep Neck Point, Broad Creek, Chesapeake Bay, Maryland;0.0;-0.05950;-0.27051;-0.48350;-0.55281;-0.08516;-0.32902
39.1063;-76.1205;Sub;xTide_0977;Deep Point, Chester River, Maryland Current;0.0;-0.08503;-0.32101;-0.55331;-0.65805;-0.13901;-0.37813
38.8055;-76.2092;Sub;xTide_0978;Deepwater Point, Miles River, Eastern Bay, Maryland Current;0.0;-0.07475;-0.28127;-0.48862;-0.56209;-0.10344;-0.33919
42.3483;-70.96;Sub;xTide_0979;Deer Island (south end), Boston Harbor, Massachusetts;0.0;-0.09649;-1.54126;-2.92995;-3.06553;-1.39735;-1.64364
30.3833;-88.8667;Ref;xTide_0980;Deer Island, Mississippi;0.0;-0.03127;-0.26397;-0.49795;-0.52566;-0.14703;-0.10888
26.3133;-80.0817;Sub;xTide_0981;Deerfield Beach, Hillsboro River, Florida;0.0;-0.04735;-0.41194;-0.78251;-0.82221;-0.22921;-0.70879
66.0972;-162.7405;Ref;xTide_0982;Deering, Kotzebue Sound, Alaska;0.0;-999999;-999999;-999999;-999999;-999999;-999999
30.3967;-81.395;Ref;xTide_0983;Degaussing structure, Mayport Naval Station, Florida;0.0;-0.04900;-0.78200;-1.51300;-1.61301;-0.63084;-0.96887
39.57;-75.59;Sub;xTide_0984;Delaware City Branch Channel bridge, Delaware River, Delaware;0.0;-999999;-999999;-999999;-999999;-999999;-999999
39.5817;-75.5883;Ref;xTide_0985;Delaware City, Delaware River, Delaware;0.0;-0.05490;-0.87934;-1.67374;-1.79534;-0.63979;-0.88730
26.4733;-80.0617;Sub;xTide_0986;Delray Beach, ICWW, Florida;0.0;-0.04200;-0.40399;-0.79900;-0.84499;-0.23281;-0.70170
40.6333;-73.2933;Sub;xTide_0987;Democrat Point, Fire Island Inlet, Long Island, New York;0.0;-0.04066;-0.50069;-0.94998;-1.02414;-0.18393;-0.53979
39.1783;-74.8517;Sub;xTide_0988;Dennis Creek, 2.5 n.mi. above entrance, Delaware Bay, New Jersey;0.0;-999999;-999999;-999999;-999999;-999999;-999999
39.1833;-74.8217;Sub;xTide_0989;Dennis Creek, Route 47 bridge, Delaware Bay, New Jersey;0.0;-999999;-999999;-999999;-999999;-999999;-999999
41.6167;-70.115;Sub;xTide_0990;Dennis Port, 2.2 miles south of, Nantucket Sound, Massachusetts Current;0.0;-0.08515;-0.67566;-1.21744;-1.31780;-0.50509;-0.77476
41.6583;-70.115;Sub;xTide_0991;Dennisport, Nantucket Sound, Massachusetts;0.0;-0.08365;-0.68648;-1.24067;-1.34228;-0.51827;-0.78690
55.7833;-159.88;Sub;xTide_0992;Dent Point, Stepovak Bay, Alaska;0.0;-999999;-999999;-999999;-999999;-999999;-999999
44.81;-124.058;Ref;xTide_0993;Depoe Bay, Oregon;0.0;-0.41800;-1.34600;-2.29500;-2.51100;-1.22160;-0.19251
47.4;-122.328;Sub;xTide_0994;Des Moines, East Passage, Puget Sound, Washington;0.0;-0.87200;-2.07900;-3.28300;-3.55400;-1.82244;-0.76211
47.6667;-124.4833;Sub;xTide_0995;Destruction Island, Washington;0.0;-0.43520;-1.43630;-2.43930;-2.67725;-1.32582;-0.26460
32.545;-80.1567;Sub;xTide_0996;Deveaux Banks, off North Edisto River entrance (Depth 12ft), South Carolina Current;0.0;-0.06087;-0.92025;-1.72296;-1.83786;-0.70256;-1.00027
56.6362;-133.6895;Sub;xTide_0997;Devils Elbow, Keku Strait, Alaska Current;0.0;-999999;-999999;-999999;-999999;-999999;-999999
47.1667;-122.763;Sub;xTide_0998;Devils Head, Drayton Passage, Puget Sound, Washington;0.0;-0.94490;-2.46579;-3.98672;-4.32161;-2.26745;-1.23376
29.2008;-89.04;Ref;xTide_0999;Devon Energy Facility, Louisiana;0.0;-0.00302;-0.16686;-0.33210;-0.33752;0.16162;0.08684
54.75;-132.5333;Sub;xTide_1000;Dewey Rocks, 2 miles west of, Cordova Bay, Alaska Current;0.0;-999999;-999999;-999999;-999999;-999999;-999999
39.0833;-74.8867;Sub;xTide_1001;Dias Creek, Route 47 bridge, Delaware Bay, New Jersey;0.0;-999999;-999999;-999999;-999999;-999999;-999999
45.4817;-123.902;Ref;xTide_1002;Dick Point, Tillamook Bay, Oregon;0.0;-0.30021;-1.17891;-2.12030;-2.33840;-0.98955;0.05185
55.15;-130.15;Sub;xTide_1003;Dickens Point, Portland Canal, Alaska Current;0.0;-999999;-999999;-999999;-999999;-999999;-999999
31.225;-81.5717;Sub;xTide_1004;Dillard Creek, Turtle River, Georgia;0.0;-0.06870;-1.26970;-2.32940;-2.44070;-1.09893;-1.40062
25.7267;-80.2367;Sub;xTide_1005;Dinner Key Marina, Biscayne Bay, Florida;0.0;-0.03640;-0.31940;-0.61380;-0.62941;-0.11487;-0.58649
39.6567;-74.27;Sub;xTide_1006;Dinner Point Creek, upper end, Little Egg Harbor, New Jersey;0.0;-999999;-999999;-999999;-999999;-999999;-999999
48.3833;-123.2;Sub;xTide_1007;Discovery Island, 3 miles SSE of, Straight of Juan de Fuca, Washington Current;0.0;-999999;-999999;-999999;-999999;-999999;-999999
48.45;-123.15;Sub;xTide_1008;Discovery Island, 3.3 miles northeast of, Washington Current;0.0;-0.44155;-1.24492;-1.91176;-2.03502;-1.13542;-0.00131
48.3;-123.1667;Sub;xTide_1009;Discovery Island, 7.6 miles SSE of, Straight of Juan de Fuca, Washington Current;0.0;-0.48355;-1.23815;-1.88884;-2.02529;-1.11937;-0.00938
25.895;-81.5583;Ref;xTide_1010;Dismal Key, Pumpkin Bay, Florida;0.0;-0.18100;-0.62300;-1.06000;-1.15000;-0.41238;-0.82071
32.4017;-80.6533;Sub;xTide_1011;Distant Island Creek, upper end, Cowen Creek, Beaufort River, South Carolina;0.0;-0.02500;-1.12701;-2.13303;-2.24903;-0.85070;-1.13255
32.3783;-80.6333;Sub;xTide_1012;Distant Island, Cowen Creek, Beaufort River, South Carolina;0.0;-0.05206;-1.18619;-2.16919;-2.28936;-0.92971;-1.21175
55.1833;-133.2833;Sub;xTide_1013;Diver Islands, Meares Passage, Alaska Current;0.0;-999999;-999999;-999999;-999999;-999999;-999999
55.2517;-132.3;Sub;xTide_1014;Divide Head, Cholmondeley Sound, Alaska;0.0;-999999;-999999;-999999;-999999;-999999;-999999
39.2167;-75.1033;Sub;xTide_1015;Dividing Creek entrance, Delaware Bay, New Jersey;0.0;-999999;-999999;-999999;-999999;-999999;-999999
33.5417;-79.0283;Sub;xTide_1016;Divine's Dock, Murrells Inlet, South Carolina;0.0;-0.04803;-0.69802;-1.33400;-1.45498;-0.49595;-0.81923
28.8817;-82.635;Ref;xTide_1017;Dixie Bay, Salt River, Crystal Bay, Florida;0.0;-0.06500;-0.31285;-0.57883;-0.66089;-0.10798;-0.37151
37.5067;-76.4167;Sub;xTide_1018;Dixie, Piankatank River, Virginia;0.0;-0.03000;-0.22874;-0.42642;-0.45648;-0.02912;-0.33663
58.3833;-136.867;Sub;xTide_1019;Dixon Harbor, Alaska;0.0;-999999;-999999;-999999;-999999;-999999;-999999
31.4033;-81.3283;Sub;xTide_1020;Doboy Island (North River) (Depth 12ft), Doboy Sound, Georgia Current;0.0;-0.06460;-1.14092;-2.16060;-2.27840;-0.95987;-1.26143
31.4033;-81.3283;Sub;xTide_1021;Doboy Island (North River) (Depth 20ft), Doboy Sound, Georgia Current;0.0;-0.06460;-1.14092;-2.16060;-2.27840;-0.95987;-1.26143
30.3477;-88.5054;Ref;xTide_1022;Dock E, Port of Pascagoula, Mississippi;0.0;-999999;-999999;-999999;-999999;-999999;-999999
39.3517;-74.54;Sub;xTide_1023;Dock Thorofare, Risley Channel, New Jersey;0.0;-0.04969;-0.65747;-1.24478;-1.36378;-0.33199;-0.72734
34.0787;-77.9325;Sub;xTide_1024;Doctor Point, 0.6 mile NNW of (Depth 16ft), Cape Fear River, North Carolina Current;0.0;-0.04710;-0.70678;-1.32692;-1.41548;-0.44664;-0.77282
34.0787;-77.9325;Sub;xTide_1025;Doctor Point, 0.6 mile NNW of (Depth 26ft), Cape Fear River, North Carolina Current;0.0;-0.04710;-0.70678;-1.32692;-1.41548;-0.44664;-0.77282
34.0787;-77.9325;Sub;xTide_1026;Doctor Point, 0.6 mile NNW of (Depth 6ft), Cape Fear River, North Carolina Current;0.0;-0.04710;-0.70678;-1.32692;-1.41548;-0.44664;-0.77282
25.77;-80.1683;Sub;xTide_1027;Dodge Island, Fishermans Channel, Biscayne Bay, Florida;0.0;-0.04121;-0.36036;-0.68833;-0.70901;-0.15936;-0.63421
47.1417;-122.903;Sub;xTide_1028;Dofflemeyer Point, Boston Hbr., Budd Inlet, Puget Sound, Washington;0.0;-0.94198;-2.52095;-4.09692;-4.37995;-2.26780;-1.23456
31.5317;-81.27;Sub;xTide_1029;Dog Hammock, Sapelo River, Georgia;0.0;-0.06518;-1.19478;-2.22464;-2.33684;-1.00049;-1.30210
29.81;-84.585;Ref;xTide_1030;Dog Island, east end, St. George Sound, Florida;0.0;-0.17019;-0.41916;-0.69016;-0.74621;-0.28940;-0.47411
18.2971;-64.8178;Ref;xTide_1031;Dog Island, St. Thomas, Virgin Islands;0.0;-0.03503;-0.11971;-0.22361;-0.25806;-999999;-0.37575
29.785;-84.6667;Sub;xTide_1032;Dog Island, west end, St. George Sound, Florida;0.0;-0.17160;-0.40400;-0.66550;-0.72052;-0.24415;-0.42507
30.5652;-88.088;Ref;xTide_1033;Dog River Bridge, Alabama;0.0;-0.02560;-0.24270;-0.45970;-0.48834;-0.11775;-0.10458
55.1217;-161.792;Ref;xTide_1034;Dolgoi Harbor, Dolgoi Island, Alaska;0.0;-999999;-999999;-999999;-999999;-999999;-999999
58.11;-153.155;Sub;xTide_1035;Dolphin Point, Raspberry Strait, Alaska;0.0;-999999;-999999;-999999;-999999;-999999;-999999
26.855;-82.3033;Ref;xTide_1036;Don Pedro Island State Park, cutoff (south), Florida;0.0;-0.09904;-0.24105;-0.37705;-0.45404;-0.05998;-0.40231
26.8817;-80.07;Sub;xTide_1037;Donald Ross Bridge, ICWW, Florida;0.0;-0.04451;-0.39100;-0.73607;-0.78143;-0.23365;-0.69407
54.71;-163.267;Sub;xTide_1038;Dora Harbor, Unimak Island, Alaska;0.0;-999999;-999999;-999999;-999999;-999999;-999999
18.3712;-64.9635;Ref;xTide_1039;Dorothea Bay, St. Thomas, Virgin Islands;0.0;-0.03478;-0.17784;-0.31930;-0.39456;-999999;0.02667
56.7217;-135.075;Sub;xTide_1040;Dorothy Cove, Necker Bay, Baranof Island, Alaska;0.0;-999999;-999999;-999999;-999999;-999999;-999999
39.745;-74.2017;Sub;xTide_1041;Double Creek, Barnegat Bay, New Jersey;0.0;-999999;-999999;-999999;-999999;-999999;-999999
32.1383;-80.9317;Sub;xTide_1042;Doughboy Island, New River, South Carolina;0.0;-0.06749;-1.16880;-2.09629;-2.20073;-0.83129;-1.11134
58.283;-134.3937;Sub;xTide_1043;Douglas, north of (Depth 15ft), Gastineau Channel, Stephens Passage, Alaska Current;0.0;-999999;-999999;-999999;-999999;-999999;-999999
58.283;-134.3937;Sub;xTide_1044;Douglas, north of (Depth 25ft), Gastineau Channel, Stephens Passage, Alaska Current;0.0;-999999;-999999;-999999;-999999;-999999;-999999
31.0167;-81.5283;Sub;xTide_1045;Dover Bluff, Dover Creek, Georgia;0.0;-999999;-999999;-999999;-999999;-999999;-999999
38.7567;-75.9983;Sub;xTide_1046;Dover Bridge, Choptank River, Maryland;0.0;-0.11266;-0.38080;-0.64013;-0.79145;-0.14285;-0.38055
38.7567;-75.9987;Sub;xTide_1047;Dover Bridge, Choptank River, Maryland Current;0.0;-0.11256;-0.38069;-0.63988;-0.79104;-0.14275;-0.38044
43.1217;-70.8333;Sub;xTide_1048;Dover Point, Piscataqua River, New Hampshire;0.0;-0.05071;-0.60188;-1.27259;-1.39729;-0.41497;-0.64620
43.1983;-70.8683;Ref;xTide_1049;Dover, Cocheco River, Piscataqua River, New Hampshire;0.0;-999999;-999999;-999999;-999999;-999999;-999999
57.7393;-152.8734;Ref;xTide_1050;Dovolno Point, Kizhuyak Bay, Alaska;0.0;-999999;-999999;-999999;-999999;-999999;-999999
43.7517;-70.14;Sub;xTide_1051;Doyle Point, Casco Bay, Maine;0.0;-0.09865;-1.50445;-2.88665;-3.02225;-1.34229;-1.54936
37.9961;-122.9767;Ref;xTide_1052;Drakes Bay, Point Reyes, California;0.0;-0.36100;-0.94600;-1.55400;-1.75800;-0.80707;-0.00789
34.1922;-77.9575;Sub;xTide_1053;Dram Tree Point, 0.5 mile SSE of, Cape Fear River, North Carolina Current;0.0;-0.04700;-0.74040;-1.36414;-1.44460;-0.44005;-0.73168
48.9908;-122.7678;Sub;xTide_1054;Drayton Harbor Entrance, Georgia Strait, Washington Current;0.0;-999999;-999999;-999999;-999999;-999999;-999999
48.9917;-122.765;Ref;xTide_1055;Drayton Harbor, Blaine, Strait of Georgia, Washington;0.0;-999999;-999999;-999999;-999999;-999999;-999999
32.8483;-80.0517;Sub;xTide_1056;Drayton, Bee's Ferry, Ashley River, South Carolina;0.0;-0.06000;-1.00900;-1.79502;-1.89200;-0.72881;-1.02638
55.1833;-131.6;Sub;xTide_1057;Driest Point, Nichols Passage, Alaska Current;0.0;-999999;-999999;-999999;-999999;-999999;-999999
44.4133;-123.99;Sub;xTide_1058;Drift Creek, Alsea River, Oregon;0.0;-0.20288;-0.90167;-1.75552;-1.96549;-0.85438;0.20988
60.555;-152.133;Sub;xTide_1059;Drift River Terminal, Cook Inlet, Alaska;0.0;-999999;-999999;-999999;-999999;-999999;-999999
52.9583;-168.72;Sub;xTide_1060;Driftwood Bay, Umnak Island, Alaska;0.0;-999999;-999999;-999999;-999999;-999999;-999999
32.8162;-79.9228;Sub;xTide_1061;Drum Island Reach, off Drum I., Buoy '45', Charleston Harbor, South Carolina Current;0.0;-0.05695;-0.91820;-1.68874;-1.79666;-0.66315;-0.96298
32.8197;-79.9292;Sub;xTide_1062;Drum Island, 0.2 mile above, Cooper River, Charleston Harbor, South Carolina Current;0.0;-0.05796;-0.92205;-1.69334;-1.80034;-0.66094;-0.96084
32.7945;-79.9208;Sub;xTide_1063;Drum Island, 0.4 mile SSE of, Charleston Harbor, South Carolina Current;0.0;-0.05715;-0.90074;-1.66630;-1.77466;-0.66082;-0.96072
32.8045;-79.9153;Sub;xTide_1064;Drum Island, east of (bridge), Charleston Harbor, South Carolina Current;0.0;-0.05690;-0.90859;-1.67730;-1.78610;-0.66464;-0.96462
38.3155;-76.4192;Sub;xTide_1065;Drum Point, 0.3 mile SSE of, Patuxent River, Maryland Current;0.0;-0.05760;-0.23637;-0.41106;-0.47344;-0.02718;-0.28390
30.4092;-81.6028;Sub;xTide_1066;Drummond Point, channel south of (Depth 17ft), St. Johns River, Florida Current;0.0;-0.02694;-0.48644;-0.93153;-0.97478;-0.26651;-0.58567
30.4092;-81.6028;Sub;xTide_1067;Drummond Point, channel south of (Depth 27ft), St. Johns River, Florida Current;0.0;-0.02694;-0.48644;-0.93153;-0.97478;-0.26651;-0.58567
30.4092;-81.6028;Sub;xTide_1068;Drummond Point, channel south of (Depth 7ft), St. Johns River, Florida Current;0.0;-0.02694;-0.48644;-0.93153;-0.97478;-0.26651;-0.58567
56.1633;-133.413;Ref;xTide_1069;Dry Pass, El Capitan Passage, Alaska;0.0;-999999;-999999;-999999;-999999;-999999;-999999
57.95;-153.0333;Sub;xTide_1070;Dry Spruce Island, Kupreanof Strait, Alaska;0.0;-999999;-999999;-999999;-999999;-999999;-999999
56.615;-132.575;Sub;xTide_1071;Dry Strait, Frederick Sound, Alaska;0.0;-999999;-999999;-999999;-999999;-999999;-999999
7.3667;-151.8833;Sub;xTide_1072;Dublon Island, Chuuk, F.S.M.;0.0;-999999;-999999;-999999;-999999;-999999;-999999
32.83;-79.9667;Sub;xTide_1073;Duck Island, Ashley River, South Carolina;0.0;-0.05985;-0.95499;-1.73787;-1.84245;-0.71969;-1.02026
24.6233;-81.685;Sub;xTide_1074;Duck Key Point, Duck Key, Waltz Key Basin, Florida;0.0;-0.06896;-0.28891;-0.54783;-0.62585;-0.06792;-0.48148
24.765;-80.9133;Sub;xTide_1075;Duck Key, Hawk Channel, Florida;0.0;-0.03998;-0.24692;-0.44784;-0.50684;-0.07265;-0.52066
34.72;-76.67;Ref;xTide_1076;Duke Marine Lab, Beaufort, North Carolina;0.0;-0.04300;-0.52100;-0.99100;-1.07800;-0.32511;-0.62510
37.5067;-122.115;Ref;xTide_1077;Dumbarton Highway Bridge, San Francisco Bay, California;0.0;-0.38260;-1.42608;-2.43700;-2.62510;-1.23109;-0.41381
25.9417;-80.125;Sub;xTide_1078;Dumfoundling Bay, Florida;0.0;-0.04300;-0.34900;-0.65900;-0.68000;-0.09916;-0.57600
28.0133;-82.7933;Sub;xTide_1079;Dunedin, St. Joseph Sound, Florida;0.0;-0.15703;-0.47500;-0.77003;-0.87604;-0.27157;-0.53340
30.7633;-81.4717;Ref;xTide_1080;Dungeness, Seacamp Dock, Georgia;0.0;-0.06000;-1.04400;-1.95900;-2.06700;-0.84261;-1.19923
48.1667;-123.117;Sub;xTide_1081;Dungeness, Strait of Juan de Fuca, Washington;0.0;-0.75073;-1.37905;-2.05995;-2.24229;-1.24507;-0.15808
33.8583;-78.57;Sub;xTide_1082;Dunn Sound, Little River Inlet, South Carolina;0.0;-0.05257;-0.78236;-1.50307;-1.61844;-0.56545;-0.88539
33.86;-78.58;Sub;xTide_1083;Dunn Sound, north end, South Carolina;0.0;-0.04900;-0.76600;-1.47300;-1.59200;-0.54363;-0.86400
33.8517;-78.5883;Sub;xTide_1084;Dunn Sound, west end, South Carolina;0.0;-999999;-999999;-999999;-999999;-999999;-999999
47.1183;-122.665;Sub;xTide_1085;Dupont Wharf, Nisqually Reach, Puget Sound, Washington;0.0;-0.89900;-2.36800;-3.83400;-4.11800;-2.18666;-1.14028
33.0583;-79.9367;Sub;xTide_1086;Dupont, Dean Hall, Cooper River, South Carolina;0.0;-0.06397;-0.60264;-1.05769;-1.13336;0.06787;-0.23586
53.8917;-166.537;Sub;xTide_1087;Dutch Harbor, Amaknak Island, Unalaska Island, Alaska;0.0;-999999;-999999;-999999;-999999;-999999;-999999
41.4967;-71.4033;Sub;xTide_1088;Dutch Island and Beaver Head, between, Narragansett Bay, Rhode Island Current;0.0;-0.04445;-0.53364;-1.09549;-1.17055;-0.35707;-0.63090
31.9917;-81.02;Sub;xTide_1089;Dutch Island, SE of, Skidaway River (Depth 10ft), Wassaw Sound, Georgia Current;0.0;-999999;-999999;-999999;-999999;-999999;-999999
41.505;-71.41;Sub;xTide_1090;Dutch Island, west of (Depth 7ft), Narragansett Bay, Rhode Island Current;0.0;-0.04450;-0.53696;-1.10460;-1.17985;-0.36644;-0.64043
47.535;-122.322;Sub;xTide_1091;Duwamish Waterway, Eighth Ave. South, Puget Sound, Washington;0.0;-999999;-999999;-999999;-999999;-999999;-999999
42.0383;-70.67;Ref;xTide_1092;Duxbury, Duxbury Harbor, Cape Cod Bay, Massachusetts;0.0;-0.10590;-1.67422;-3.11987;-3.25396;-1.55298;-1.80604
41.575;-71.2967;Sub;xTide_1093;Dyer Island-Carrs Point (between), Narragansett Bay, Rhode Island Current;0.0;-0.04687;-0.58855;-1.20744;-1.28257;-0.42858;-0.69321
41.5867;-71.3083;Sub;xTide_1094;Dyer Island, west of (Depth 7ft), Narragansett Bay, Rhode Island Current;0.0;-0.04700;-0.59057;-1.21176;-1.28714;-0.43095;-0.69653
53.4833;-166.9333;Sub;xTide_1095;Eagle Bay, Unalaska Island, Alaska;0.0;-999999;-999999;-999999;-999999;-999999;-999999
31.51;-81.2783;Sub;xTide_1096;Eagle Creek, Mud River, Georgia;0.0;-0.06487;-1.22369;-2.27021;-2.38341;-1.03384;-1.33528
47.62;-122.515;Sub;xTide_1097;Eagle Harbor, Bainbridge Island, Puget Sound, Washington;0.0;-0.88400;-2.04200;-3.20000;-3.44400;-1.80350;-0.73940
56.6073;-133.6822;Sub;xTide_1098;Eagle Island, 0.5 mile southeast of, Keku Strait, Alaska Current;0.0;-999999;-999999;-999999;-999999;-999999;-999999
31.65;-81.305;Sub;xTide_1099;Eagle Neck, South Newport River, Georgia;0.0;-999999;-999999;-999999;-999999;-999999;-999999
29.48;-94.9183;Ref;xTide_1100;Eagle Point, Galveston Bay, Texas;0.0;-0.01703;-0.18300;-0.32400;-0.33500;0.02119;0.02391
40.79;-73.935;Sub;xTide_1101;East 107th Street (Depth 15ft), Harlem River, New York Current;0.0;-0.06477;-0.79547;-1.50567;-1.60454;-0.48652;-0.81814
40.7467;-73.9683;Sub;xTide_1102;East 41st Street, New York City, East River, New York;0.0;-0.07300;-0.73198;-1.38687;-1.48987;-0.46337;-0.79549
25.3733;-80.29;Ref;xTide_1103;East Arsenicker, Card Sound, Florida;0.0;-0.02401;-0.15490;-0.29476;-0.30979;0.05362;-0.41460
24.775;-81.2267;Sub;xTide_1104;East Bahia Honda Key, south end, Florida Bay, Florida;0.0;-0.09198;-0.20798;-0.36199;-0.42196;-0.05198;-0.47656
30.0503;-90.368;Ref;xTide_1105;East Bank 1, Norco, Bayou LaBranche, Louisiana;0.0;-999999;-999999;-999999;-999999;-999999;-999999
30.45;-86.9183;Sub;xTide_1106;East Bay, Pensacola Bay, Florida;0.0;-0.01703;-0.22600;-0.43300;-0.45700;-0.05168;-0.13094
43.865;-69.5833;Sub;xTide_1107;East Boothbay, Damariscotta River, Maine;0.0;-0.10830;-1.50812;-2.88691;-3.01773;-1.43727;-1.65244
33.0683;-79.92;Sub;xTide_1108;East Branch, 0.2 mile above entrance, Cooper River, South Carolina Current;0.0;-0.06453;-0.55173;-0.96730;-1.03953;0.12339;-0.17894
57.1667;-135.55;Sub;xTide_1109;East Channel (narrows), Krestof Sound, Alaska Current;0.0;-999999;-999999;-999999;-999999;-999999;-999999
41.465;-70.5367;Sub;xTide_1110;East Chop-Squash Meadow, between, Nantucket Sound, Massachusetts Current;0.0;-0.03898;-0.37923;-0.63223;-0.70289;-0.20973;-0.47584
41.485;-70.5583;Sub;xTide_1111;East Chop, 1 mile north of, Nantucket Sound, Massachusetts Current;0.0;-0.06393;-0.34051;-0.54439;-0.63376;-0.17359;-0.43862
52.6533;-170.563;Sub;xTide_1112;East Cove, Yunaska Island, Alaska;0.0;-999999;-999999;-999999;-999999;-999999;-999999
39.2083;-74.9017;Sub;xTide_1113;East Creek, Route 47 bridge, Delaware Bay, New Jersey;0.0;-999999;-999999;-999999;-999999;-999999;-999999
54.7;-131.0833;Sub;xTide_1114;East Devil Rock, 1 mile north of, Dixon Entrance, Alaska Current;0.0;-999999;-999999;-999999;-999999;-999999;-999999
60.7167;-151.4167;Sub;xTide_1115;East Foreland, Cook Inlet, Alaska;0.0;-999999;-999999;-999999;-999999;-999999;-999999
30.4437;-88.1139;Ref;xTide_1116;East Fowl River Bridge, Alabama;0.0;-999999;-999999;-999999;-999999;-999999;-999999
41.665;-71.445;Sub;xTide_1117;East Greenwich, Narragansett Bay, Rhode Island;0.0;-0.04780;-0.61160;-1.26162;-1.34238;-0.46193;-0.72241
23.7833;-166.208;Sub;xTide_1118;East Island, French Frigate Shoals, Hawaii;0.0;-999999;-999999;-999999;-999999;-999999;-999999
29.0717;-90.64;Ref;xTide_1119;East Isle Dernière, Lake Pelto, Louisiana;0.0;-0.01800;-0.21000;-0.39900;-0.41800;-0.15390;-0.13026
24.9967;-80.61;Sub;xTide_1120;East Key, southern end, Florida Bay, Florida;0.0;-0.00400;-0.07900;-0.16000;-0.18600;0.12726;-0.33802
30.395;-86.5133;Sub;xTide_1121;East Pass (Destin), Choctawhatchee Bay, Florida;0.0;-0.00321;-0.08618;-0.18412;-0.18621;0.16141;0.03676
56.3833;-132.4;Sub;xTide_1122;East Point, east of, Zimovia Strait, Alaska Current;0.0;-999999;-999999;-999999;-999999;-999999;-999999
39.2;-75.02;Sub;xTide_1123;East Point, Maurice River Cove, Delaware Bay, New Jersey;0.0;-0.06390;-0.97450;-1.81660;-1.95360;-0.69339;-1.05014
40.8467;-74.12;Sub;xTide_1124;East Rutherford, Passaic River, New Jersey;0.0;-999999;-999999;-999999;-999999;-999999;-999999
29.0767;-90.285;Ref;xTide_1125;East Timbalier Island, Timbalier Bay, Louisiana;0.0;-0.01100;-0.20900;-0.39100;-0.40200;-0.13969;-0.12345
38.7683;-76.095;Sub;xTide_1126;Easton Point, Tred Avon River, Maryland;0.0;-999999;-999999;-999999;-999999;-999999;-999999
44.9046;-66.9829;Ref;xTide_1127;Eastport, Passamaquoddy Bay, Maine;0.0;-0.13543;-2.95744;-5.72688;-5.87223;-5.17763;-3.02753
55.9528;-132.09;Sub;xTide_1128;Eaton Point, Ernest Sound, Alaska Current;0.0;-999999;-999999;-999999;-999999;-999999;-999999
40.9533;-73.4;Ref;xTide_1129;Eatons Neck Point, Long Island, New York;0.0;-0.07700;-1.16300;-2.24600;-2.35200;-0.91244;-1.22926
4.6;-168.6833;Sub;xTide_1130;Ebon (Boston) Atoll, Marshall Islands;0.0;-999999;-999999;-999999;-999999;-999999;-999999
48.7567;-122.897;Sub;xTide_1131;Echo Bay, Sucia Islands, Strait of Georgia, Washington;0.0;-0.79784;-1.56271;-2.41300;-2.64826;-1.44534;-0.25575
32.4467;-80.5333;Sub;xTide_1132;Edding Point, Edding Creek, Morgan River, South Carolina;0.0;-0.06401;-1.12101;-2.01801;-2.12901;-0.89769;-1.17896
27.2867;-80.2267;Sub;xTide_1133;Eden, Nettles Island, Indian River, Florida;0.0;-0.03610;-0.21482;-0.38879;-0.42338;-0.05313;-0.50402
41.3883;-70.5117;Ref;xTide_1134;Edgartown, Martha's Vineyard, Massachusetts;0.0;-0.06867;-0.43523;-0.71919;-0.81574;-0.25784;-0.52718
40.1283;-74.8233;Sub;xTide_1135;Edgely, Pennsylvania;0.0;-0.06979;-1.27348;-2.39803;-2.51979;-0.77115;-1.09459
39.75;-75.4933;Sub;xTide_1136;Edgemoor, Delaware River, Delaware;0.0;-0.06384;-0.90418;-1.74440;-1.87496;-0.57393;-0.86826
