Latitude;Longitude;Type;StationID;StationName;MLLW;MLW;MSL;MHW;MHHW;NGVD;NAVD
37.22;-76.6633;Ref;xTide_1904;Kingsmill, James River, Virginia;0.0;-0.04714;-0.39080;-0.73374;-0.79851;-0.14893;-0.41173
47.7967;-122.493;Sub;xTide_1905;Kingston, Appletree Cove, Puget Sound, Washington;0.0;-0.86000;-1.97500;-3.09100;-3.35000;-1.75053;-0.66573
41.9183;-73.9833;Sub;xTide_1906;Kingston, Hudson River, New York;0.0;-999999;-999999;-999999;-999999;-999999;-999999
38.0317;-76.5767;Sub;xTide_1907;Kinsale, Yeocomico River, Virginia;0.0;-999999;-999999;-999999;-999999;-999999;-999999
37.1652;-75.9884;Ref;xTide_1908;Kiptopeke Beach, Chesapeake Bay, Virginia;0.0;-0.03401;-0.43414;-0.82852;-0.89716;-0.32851;-0.57999
51.9833;-177.55;Sub;xTide_1909;Kiska Harbor, Kiska Island, Rat Islands, Alaska;0.0;-999999;-999999;-999999;-999999;-999999;-999999
53.7133;-166.572;Sub;xTide_1910;Kisselen Bay, Beaver Inlet, Unalaska Island, Alaska;0.0;-999999;-999999;-999999;-999999;-999999;-999999
43.0817;-70.7033;Sub;xTide_1911;Kittery Point, Portsmouth Harbor, New Hampshire;0.0;-0.10311;-1.44348;-2.75534;-2.88593;-1.29670;-1.53090
36.1017;-75.71;Sub;xTide_1912;Kitty Hawk (ocean), North Carolina;0.0;-0.04334;-0.53234;-1.01544;-1.11344;-0.35396;-0.64778
67.7267;-164.592;Ref;xTide_1913;Kivalina, Alaska;0.0;-999999;-999999;-999999;-999999;-999999;-999999
57.82;-152.9;Sub;xTide_1914;Kizhuyak Bay, Alaska;0.0;-999999;-999999;-999999;-999999;-999999;-999999
57.9;-152.65;Sub;xTide_1915;Kizhuyak Point, Alaska;0.0;-999999;-999999;-999999;-999999;-999999;-999999
57.4167;-135.89;Sub;xTide_1916;Klokachef Island, Alaska;0.0;-999999;-999999;-999999;-999999;-999999;-999999
46.1867;-123.588;Sub;xTide_1917;Knappa, Knappa Slough, Oregon;0.0;-0.30300;-1.33000;-2.33600;-2.54300;-0.81622;0.21481
24.7067;-81.125;Sub;xTide_1918;Knight Key Channel, Knight Key, Florida Bay, Florida;0.0;-0.03201;-0.14488;-0.24988;-0.32179;-0.02523;-0.44824
24.715;-81.4783;Sub;xTide_1919;Knockemdown Key, north end, Florida;0.0;-0.08704;-0.31597;-0.62296;-0.70596;-0.12866;-0.54659
57.7833;-152.428;Sub;xTide_1920;Kodiak, Port of Kodiak, Alaska;0.0;-999999;-999999;-999999;-999999;-999999;-999999
57.745;-152.483;Sub;xTide_1921;Kodiak, St. Paul Harbor, Alaska;0.0;-999999;-999999;-999999;-999999;-999999;-999999
57.7317;-152.512;Ref;xTide_1922;Kodiak, Women's Bay, Alaska;0.0;-999999;-999999;-999999;-999999;-999999;-999999
21.0933;-157.197;Sub;xTide_1923;Kolo, Molokai Island, Hawaii;0.0;-999999;-999999;-999999;-999999;-999999;-999999
66.9017;-162.582;Ref;xTide_1924;Kotzebue, Kotzebue Sound, Alaska;0.0;-999999;-999999;-999999;-999999;-999999;-999999
20.595;-156.607;Sub;xTide_1925;Kuheia Bay, Kahoolawe Island, Hawaii;0.0;-999999;-999999;-999999;-999999;-999999;-999999
56.0369;-134.115;Sub;xTide_1926;Kuiu Island, Affleck Canal, Alaska;0.0;-999999;-999999;-999999;-999999;-999999;-999999
56.6133;-157.983;Sub;xTide_1927;Kujulik Bay (North Shore), Alaska;0.0;-999999;-999999;-999999;-999999;-999999;-999999
58.3417;-154.117;Sub;xTide_1928;Kukak, Kukak Bay, Alaska;0.0;-999999;-999999;-999999;-999999;-999999;-999999
53.4617;-167.02;Sub;xTide_1929;Kuliliak Bay, Unalaska Island, Alaska;0.0;-999999;-999999;-999999;-999999;-999999;-999999
55.79;-159.35;Sub;xTide_1930;Kupreanof Harbor, Paul Island, Alaska;0.0;-999999;-999999;-999999;-999999;-999999;-999999
58.7;-157.25;Ref;xTide_1931;Kvichak Bay (off Naknek River entrance), Alaska Current;0.0;-999999;-999999;-999999;-999999;-999999;-999999
58.97;-156.947;Sub;xTide_1932;Kvichak, Kvichak River, Alaska;0.0;-999999;-999999;-999999;-999999;-999999;-999999
9.4;-167.4833;Sub;xTide_1933;Kwajalein Atoll (Namur Island), Marshall Islands;0.0;-999999;-999999;-999999;-999999;-999999;-999999
8.7316;-167.7362;Ref;xTide_1934;Kwajalein, Marshall Islands;0.0;-999999;-999999;-999999;-999999;-999999;-999999
41.5267;-70.5767;Sub;xTide_1935;L'Hommedieu Shoal, north of west end, Nantucket Sound, Massachusetts Current;0.0;-0.07188;-0.29966;-0.46813;-0.56511;-0.13512;-0.39878
48.3917;-122.497;Sub;xTide_1936;La Conner, Swinomish Channel, Washington;0.0;-0.82202;-1.81743;-2.87478;-3.15476;-1.61576;-0.46119
32.8667;-117.258;Ref;xTide_1937;La Jolla (Scripps Institution Wharf), California;0.0;-0.27485;-0.83124;-1.39902;-1.62197;-0.70664;-0.05720
47.9133;-124.637;Ref;xTide_1938;La Push, Quillayute River, Washington;0.0;-0.42782;-1.42273;-2.42964;-2.65061;-1.34741;-0.25284
36.8842;-76.2759;Ref;xTide_1939;Lafayette River, Virginia;0.0;-999999;-999999;-999999;-999999;-999999;-999999
33.3687;-79.252;Sub;xTide_1940;Lafayette swing bridge, Waccamaw River, Winyah Bay, South Carolina Current;0.0;-0.03314;-0.60561;-1.12944;-1.20841;-0.24777;-0.55352
29.6667;-90.1117;Ref;xTide_1941;Lafitte, Barataria Waterway, Louisiana;0.0;-999999;-999999;-999999;-999999;-999999;-999999
20.8833;-156.6833;Sub;xTide_1942;Lahaina, Maui Island, Hawaii;0.0;-999999;-999999;-999999;-999999;-999999;-999999
21.65;-157.9333;Sub;xTide_1943;Laie Bay, Oahu Island, Hawaii;0.0;-999999;-999999;-999999;-999999;-999999;-999999
30.1217;-85.5283;Sub;xTide_1944;Laird Bayou, East Bay, St. Andrew Bay, Florida;0.0;-0.03285;-0.22588;-0.42284;-0.44788;-0.03106;-0.18463
56.0233;-132.92;Sub;xTide_1945;Lake Bay, Alaska;0.0;-999999;-999999;-999999;-999999;-999999;-999999
30.2236;-93.2217;Ref;xTide_1946;Lake Charles, Calcasieu River, Louisiana;0.0;-0.06600;-0.22600;-0.37700;-0.40800;-0.15633;-0.13160
30.3983;-81.6983;Sub;xTide_1947;Lake Forest, Ribault River, Trout River, Florida;0.0;-0.02500;-0.41282;-0.81845;-0.84971;-0.14093;-0.46394
41.0733;-71.935;Ref;xTide_1948;Lake Montauk, Long Island, New York;0.0;-0.05189;-0.35772;-0.66351;-0.75045;-0.17707;-0.46509
36.825;-75.9817;Sub;xTide_1949;Lake Rudee, south end, Virginia;0.0;-999999;-999999;-999999;-999999;-999999;-999999
26.9117;-80.08;Sub;xTide_1950;Lake Worth Creek, Day Beacon 19, ICWW, Florida;0.0;-0.04595;-0.36298;-0.67395;-0.71794;-0.20485;-0.66398
26.6133;-80.0467;Ref;xTide_1951;Lake Worth ICW, Florida;0.0;-0.04003;-0.44100;-0.85800;-0.90801;-0.27544;-0.74501
26.6117;-80.0333;Ref;xTide_1952;Lake Worth Pier, Florida;0.0;-0.04200;-0.46000;-0.87400;-0.91700;-0.27717;-0.74795
26.37;-80.07;Ref;xTide_1953;Lake Wyman, ICWW, Florida;0.0;-0.04610;-0.35390;-0.69935;-0.73765;-0.23068;-0.70676
38.2;-122.5667;Sub;xTide_1954;Lakeville, Petaluma River, San Pablo Bay, California;0.0;-0.27890;-1.04408;-1.76872;-1.94145;-0.83364;-0.01703
18.3182;-64.7242;Ref;xTide_1955;Lameshur Bay, St. John, Virgin Islands;0.0;-0.01569;-0.11848;-0.23662;-0.24948;-999999;-0.11687
29.8783;-84.595;Ref;xTide_1956;Lanark, St. George Sound, Florida;0.0;-0.18498;-0.45198;-0.73710;-0.79710;-0.32798;-0.50087
55.2133;-132.095;Sub;xTide_1957;Lancaster Cove, Cholmondeley Sound, Alaska;0.0;-999999;-999999;-999999;-999999;-999999;-999999
60.8533;-146.535;Sub;xTide_1958;Landlocked Bay, Port Fidalgo, Prince William Sound, Alaska;0.0;-999999;-999999;-999999;-999999;-999999;-999999
30.4317;-89.0817;Ref;xTide_1959;Landon, Mississippi;0.0;-999999;-999999;-999999;-999999;-999999;-999999
37.4033;-76.9117;Ref;xTide_1960;Lanexa, Chickahominy River, Virginia;0.0;-0.02836;-0.39349;-0.81352;-0.87622;-0.06252;-0.40403
30.425;-88.87;Ref;xTide_1961;Langley Point, Mississippi;0.0;-0.03940;-0.27430;-0.51060;-0.54210;-0.15582;-0.11798
18.3167;-65.5833;Sub;xTide_1962;Largo Shoals, west of, Puerto Rico Current;0.0;-0.05190;-0.20734;-0.36150;-0.43980;-999999;-0.18240
25.14;-80.395;Sub;xTide_1963;Largo Sound, Key Largo, Florida;0.0;-999999;-999999;-999999;-999999;-999999;-999999
57.5333;-153.99;Ref;xTide_1964;Larsen Bay, Kodiak Island, Alaska;0.0;-999999;-999999;-999999;-999999;-999999;-999999
17.9283;-66.1583;Ref;xTide_1965;Las Mareas, Puerto Rico;0.0;-0.00621;-0.10142;-0.20288;-0.20506;-999999;-0.07392
51.6717;-178.045;Sub;xTide_1966;Lash Bay, Tanaga Island, Alaska;0.0;-999999;-999999;-999999;-999999;-999999;-999999
51.825;-176.402;Sub;xTide_1967;Laska Cove, Kagalaska Island, Aleutian Islands, Alaska;0.0;-999999;-999999;-999999;-999999;-999999;-999999
60.0533;-147.907;Sub;xTide_1968;Latouche, Latouche Island, Prince William Sound, Alaska;0.0;-999999;-999999;-999999;-999999;-999999;-999999
26.1883;-80.0933;Sub;xTide_1969;Lauderdale-by-the-Sea, Anglin Fishing Pier, Florida;0.0;-0.05100;-0.44600;-0.83600;-0.87300;-0.21856;-0.70139
29.4492;-91.3381;Ref;xTide_1970;Lawma, Amerada Pass, Louisiana;0.0;-0.11001;-0.28267;-0.48703;-0.53148;-0.11258;-0.17357
48.6783;-122.7145;Sub;xTide_1971;Lawrence Point, Orcas I., 1.3 mi. NE of, Rosario Strait, Washington Current;0.0;-0.78047;-1.52367;-2.36121;-2.59931;-1.38085;-0.19906
25.7667;-171.75;Sub;xTide_1972;Laysan Island, Hawaii;0.0;-999999;-999999;-999999;-999999;-999999;-999999
32;-80.9283;Sub;xTide_1973;Lazaretto Creek Entrance, N of, Bull River (Depth 10ft), Wassaw Sound, Georgia Current;0.0;-999999;-999999;-999999;-999999;-999999;-999999
32.6367;-80.2017;Sub;xTide_1974;Leadenwah Creek, 3 mi. above entrance, North Edisto River, South Carolina;0.0;-0.06400;-1.09002;-1.89102;-2.00203;-0.85334;-1.15108
56.7883;-132.502;Ref;xTide_1975;Leconte Bay, Frederick Sound, Alaska;0.0;-999999;-999999;-999999;-999999;-999999;-999999
57.4333;-156.3;Sub;xTide_1976;Lees Cabins, Wide Bay, Alaska;0.0;-999999;-999999;-999999;-999999;-999999;-999999
29.2483;-90.2117;Ref;xTide_1977;Leeville, Bayou Lafourche, Louisiana;0.0;-999999;-999999;-999999;-999999;-999999;-999999
18.3676;-64.7207;Ref;xTide_1978;Leinster Point, Leinster Bay, St. John, Virgin Islands;0.0;-0.03814;-0.16180;-0.27834;-0.34931;-999999;0.03671
39.245;-75.5183;Sub;xTide_1979;Leipsic, Leipsic River, Delaware Bay, Delaware;0.0;-999999;-999999;-999999;-999999;-999999;-999999
32.35;-80.8067;Sub;xTide_1980;Lemon Island South, Chechessee River (Depth 10ft), South Carolina Current;0.0;-0.06200;-1.43880;-2.47850;-2.58890;-1.18493;-1.46882
55.1183;-162.378;Sub;xTide_1981;Lenard Harbor, Cold Bay, Alaska;0.0;-999999;-999999;-999999;-999999;-999999;-999999
34.7083;-76.62;Sub;xTide_1982;Lenoxville Point, North Carolina;0.0;-0.03700;-0.40202;-0.75802;-0.83004;-0.20552;-0.50300
37.5833;-76.99;Ref;xTide_1983;Lester Manor, Pamunkey River, Virginia;0.0;-0.03004;-0.45667;-0.88426;-0.94529;-0.17308;-0.53781
59.1133;-156.832;Sub;xTide_1984;Levelock, Kvichak River, Alaska;0.0;-999999;-999999;-999999;-999999;-999999;-999999
38.7817;-75.12;Ref;xTide_1985;Lewes, Fort Miles, Delaware;0.0;-0.04859;-0.68079;-1.29256;-1.42047;-0.56524;-0.80178
41.6317;-70.2733;Sub;xTide_1986;Lewis Bay entrance channel, Nantucket Sound, Massachusetts Current;0.0;-0.07765;-0.58366;-1.05095;-1.15354;-0.41143;-0.67794
37.9961;-76.4644;Ref;xTide_1987;Lewisetta, Potomac River, Virginia;0.0;-0.03390;-0.22440;-0.40883;-0.44738;0.00081;-0.24701
29.5233;-92.0433;Sub;xTide_1988;Lighthouse Point, Atchafalaya Bay, Louisiana;0.0;-0.18635;-0.38784;-0.61553;-0.64675;-0.24746;-0.26340
41.2517;-72.905;Sub;xTide_1989;Lighthouse Point, New Haven Harbor, Connecticut;0.0;-0.07126;-1.00098;-1.93441;-2.03509;-0.77979;-1.09927
24.9033;-80.695;Sub;xTide_1990;Lignumvitae Key, NE side, Florida Bay, Florida;0.0;-0.00599;-0.10500;-0.20803;-0.24001;0.08678;-0.36598
24.9;-80.705;Sub;xTide_1991;Lignumvitae Key, west side, Florida Bay, Florida;0.0;-0.00910;-0.10633;-0.21030;-0.24387;0.08471;-0.36814
9.8167;-169.3167;Sub;xTide_1992;Likiep Atoll, Marshall Islands;0.0;-999999;-999999;-999999;-999999;-999999;-999999
17.6947;-64.7538;Ref;xTide_1993;Lime Tree Bay, St. Croix, Virgin Islands;0.0;-0.00397;-0.11178;-0.21401;-0.21607;-999999;-0.11174
32.7867;-80.105;Sub;xTide_1994;Limehouse Bridge, Stono River, South Carolina;0.0;-0.07503;-1.08903;-1.77703;-1.87303;-0.75605;-1.05325
48.6263;-123.1092;Sub;xTide_1995;Limestone Point, Spieden Channel, San Juan Channel, Washington Current;0.0;-0.78112;-1.45555;-2.20503;-2.41477;-1.35299;-0.18960
58.4983;-134.965;Sub;xTide_1996;Lincoln Island, Lynn Canal, Alaska;0.0;-999999;-999999;-999999;-999999;-999999;-999999
56.05;-132.7167;Sub;xTide_1997;Lincoln Rock Light, 1 mile west from, Clarence Strait, Alaska Current;0.0;-999999;-999999;-999999;-999999;-999999;-999999
55.6017;-132.512;Ref;xTide_1998;Lindeman Cove, Kasaan Bay, Alaska;0.0;-999999;-999999;-999999;-999999;-999999;-999999
57.45;-135.0333;Sub;xTide_1999;Lindenberg Head, Peril Strait, Alaska Current;0.0;-999999;-999999;-999999;-999999;-999999;-999999
57.45;-135.0333;Sub;xTide_2000;Lindenburg Head, Alaska;0.0;-999999;-999999;-999999;-999999;-999999;-999999
55.8833;-130.0333;Sub;xTide_2001;Lion Point, Portland Canal, Alaska Current;0.0;-999999;-999999;-999999;-999999;-999999;-999999
33.4717;-79.1017;Sub;xTide_2002;Litchfield Beach bridge, South Carolina;0.0;-999999;-999999;-999999;-999999;-999999;-999999
32.165;-81.13;Sub;xTide_2003;Little Back River, Hwy. 17, Back River, Savannah River, South Carolina;0.0;-0.07600;-1.40700;-2.40000;-2.48700;-0.95534;-1.23815
32.5017;-80.7867;Sub;xTide_2004;Little Barnwell I., E of, Whale Branch River (Depth 6ft), South Carolina Current;0.0;-0.06517;-1.43515;-2.48447;-2.59776;-1.10474;-1.38694
24.915;-80.64;Sub;xTide_2005;Little Basin, Upper Matecumbe Key, Florida Bay, Florida;0.0;-0.01570;-0.11350;-0.21200;-0.23930;0.09747;-0.35920
33.6017;-79.1183;Sub;xTide_2006;Little Bull Creek entrance, Bull Creek, Waccamaw River, South Carolina;0.0;-999999;-999999;-999999;-999999;-999999;-999999
25.2883;-80.37;Ref;xTide_2007;Little Card Sound bridge, Florida;0.0;-0.01800;-0.09900;-0.18000;-0.19300;0.14592;-0.32516
36.9117;-76.175;Sub;xTide_2008;Little Creek NAB, Chesapeake Bay, Virginia;0.0;-0.04275;-0.43230;-0.82440;-0.89140;-0.29544;-0.55419
44.2917;-68.6933;Sub;xTide_2009;Little Deer Isle, Eggemoggin Reach, Maine;0.0;-0.11506;-1.68479;-3.20824;-3.33851;-1.57163;-1.77208
31.87;-81.0733;Sub;xTide_2010;Little Don Island, east of, Vernon River (Depth 10ft), Wassaw Sound, Georgia Current;0.0;-0.06384;-1.14263;-2.13556;-2.24903;-0.86829;-1.15278
24.6817;-81.2283;Sub;xTide_2011;Little Duck Key, east end, Hawk Channel, Florida;0.0;-0.04701;-0.17603;-0.30705;-0.37808;-0.03282;-0.45145
31.3183;-81.305;Sub;xTide_2012;Little Egg Island, northwest of (Depth 12ft), Altamaha Sound, Georgia Current;0.0;-0.06230;-1.10003;-2.10069;-2.21349;-0.93409;-1.23230
41.2067;-72.1017;Sub;xTide_2013;Little Gull Island, Long Island, New York;0.0;-0.05339;-0.42824;-0.76620;-0.85198;-0.24554;-0.53592
41.52;-70.665;Sub;xTide_2014;Little Harbor, Woods Hole, Massachusetts;0.0;-0.05809;-0.26484;-0.43768;-0.52305;-0.11578;-0.37839
26.3533;-81.855;Sub;xTide_2015;Little Hickory Island, Estero Bay, Florida;0.0;-0.16722;-0.45722;-0.72599;-0.80632;-0.21774;-0.58116
27.705;-82.4483;Ref;xTide_2016;Little Manatee River, Florida;0.0;-999999;-999999;-999999;-999999;-999999;-999999
31.3267;-81.3183;Sub;xTide_2017;Little Mud River Range (Depth 9ft), Altamaha Sound, Georgia Current;0.0;-0.06281;-1.11505;-2.12041;-2.23219;-0.94695;-1.24563
31.8883;-81.0983;Sub;xTide_2018;Little Ogeechee River Entrance (Depth 10ft), Wassaw Sound, Georgia Current;0.0;-0.06436;-1.15186;-2.14896;-2.26245;-0.87148;-1.15412
31.8883;-81.0983;Sub;xTide_2019;Little Ogeechee River Entrance (Depth 20ft), Wassaw Sound, Georgia Current;0.0;-0.06436;-1.15186;-2.14896;-2.26245;-0.87148;-1.15412
31.8967;-81.095;Sub;xTide_2020;Little Ogeechee River Entrance, north of (Depth 6ft), Ossabaw Sound, Georgia Current;0.0;-0.06390;-1.15150;-2.14860;-2.26170;-0.87138;-1.15367
24.75;-81.3283;Sub;xTide_2021;Little Pine Key, north end, Florida;0.0;-0.08796;-0.26298;-0.48401;-0.55097;-0.09021;-0.51516
24.7133;-81.3033;Sub;xTide_2022;Little Pine Key, south end, Florida;0.0;-0.05498;-0.18098;-0.25494;-0.33798;-0.00343;-0.42665
30.31;-81.61;Sub;xTide_2023;Little Pottsburg Creek, Florida;0.0;-0.02400;-0.32700;-0.64100;-0.67300;-0.03966;-0.37000
33.87;-78.6083;Sub;xTide_2024;Little River (town), South Carolina;0.0;-0.04547;-0.72089;-1.39503;-1.50525;-0.45516;-0.77584
33.87;-78.5733;Sub;xTide_2025;Little River Neck, north end, South Carolina;0.0;-0.04904;-0.76002;-1.45998;-1.57698;-0.54279;-0.86266
27.18;-82.495;Sub;xTide_2026;Little Sarasota Bay, south end, bridge, Florida Current;0.0;-0.11127;-0.26446;-0.42643;-0.52378;-0.13477;-0.47067
39.5217;-74.32;Sub;xTide_2027;Little Sheepshead Creek, Great Bay, New Jersey;0.0;-999999;-999999;-999999;-999999;-999999;-999999
24.7733;-81.3683;Sub;xTide_2028;Little Spanish Key, Spanish Banks, Florida;0.0;-0.11893;-0.44780;-0.80469;-0.87769;-0.28458;-0.70854
30.7317;-81.7267;Sub;xTide_2029;Little St. Marys River, St. Marys River, Florida;0.0;-0.04598;-0.79305;-1.34805;-1.40605;-0.38531;-0.73582
31.3117;-81.3533;Sub;xTide_2030;Little St. Simon Island (north) (Depth 11ft), Altamaha Sound, Georgia Current;0.0;-0.06346;-1.12875;-2.14490;-2.25287;-0.96657;-1.26305
30.43;-81.405;Sub;xTide_2031;Little Talbot Island, ocean, Florida;0.0;-0.05700;-0.86500;-1.71900;-1.84400;-0.66115;-1.00100
24.665;-81.3867;Sub;xTide_2032;Little Torch Key, Pine Channel Bridge, south side, Florida;0.0;-0.02101;-0.16703;-0.31502;-0.38602;0.01040;-0.40898
24.665;-81.3867;Sub;xTide_2033;Little Torch Key, Pine Channel Bridge, south side, Florida (2);0.0;-0.02101;-0.16703;-0.31502;-0.38602;0.01040;-0.40898
24.665;-81.395;Sub;xTide_2034;Little Torch Key, Torch Channel, Florida;0.0;-0.03689;-0.20490;-0.36797;-0.44417;-0.02652;-0.44526
31.87;-81.05;Sub;xTide_2035;Little Wassaw Island, SW of (Depth 10ft), Ossabaw Sound, Georgia Current;0.0;-0.06350;-1.13480;-2.12340;-2.23730;-0.86565;-1.15101
58.6167;-137.65;Sub;xTide_2036;Lituya Bay, 2 miles inside entrance, Alaska;0.0;-999999;-999999;-999999;-999999;-999999;-999999
38.46;-77.27;Sub;xTide_2037;Liverpool Point, Potomac River, Maryland;0.0;-0.02940;-0.25080;-0.45320;-0.48640;0.01690;-0.22705
32.5733;-80.745;Sub;xTide_2038;Lobeco, Whale Branch, Coosaw River, South Carolina;0.0;-999999;-999999;-999999;-999999;-999999;-999999
47.585;-122.362;Sub;xTide_2039;Lockheed Shipyard, Harbor Island, Puget Sound, Washington;0.0;-0.86600;-2.02700;-3.20600;-3.46900;-1.81098;-0.72678
33.9167;-78.2333;Sub;xTide_2040;Lockwoods Folly Inlet, North Carolina;0.0;-0.05590;-0.77428;-1.47786;-1.59396;-0.56944;-0.89928
26.93;-82.1367;Ref;xTide_2041;Locust Point, Hog Island, Charlotte Harbor, Florida;0.0;-0.12704;-0.30727;-0.49830;-0.59390;-0.13325;-0.47569
47.815;-122.657;Sub;xTide_2042;Lofall, Washington;0.0;-0.87200;-1.93200;-2.99300;-3.26400;-1.74448;-0.65941
30.6433;-81.5233;Ref;xTide_2043;Lofton, Lanceford Creek, Florida;0.0;-0.05998;-1.05896;-1.98796;-2.10196;-0.86545;-1.21149
24.6317;-82.92;Ref;xTide_2044;Loggerhead Key, Dry Tortugas, Florida;0.0;-0.08300;-0.25200;-0.42300;-0.50900;-0.11950;-0.48659
60.5543;-162.2971;Ref;xTide_2045;Lomavik, Alaska;0.0;-999999;-999999;-999999;-999999;-999999;-999999
29.2283;-89.05;Sub;xTide_2046;Lonesome Bayou (Thomasin), Louisiana;0.0;-0.00260;-0.18700;-0.37010;-0.37620;0.13153;0.05758
60.6917;-148.263;Sub;xTide_2047;Long Bay Entrance, Culross Passage, Prince William Sound, Alaska;0.0;-999999;-999999;-999999;-999999;-999999;-999999
40.5963;-73.6551;Ref;xTide_2048;Long Beach (Bridgeview Yacht Club), New York;0.0;-0.05125;-0.74197;-1.41654;-1.51538;-0.45238;-0.79397
40.6;-73.65;Sub;xTide_2049;Long Beach (Inside), Hempstead Bay, New York;0.0;-999999;-999999;-999999;-999999;-999999;-999999
38.465;-76.4733;Ref;xTide_2050;Long Beach, Chesapeake Bay, Maryland;0.0;-0.05108;-0.20813;-0.35960;-0.41070;-0.01407;-0.28130
33.7717;-118.21;Sub;xTide_2051;Long Beach, Inner Harbor, California;0.0;-999999;-999999;-999999;-999999;-999999;-999999
33.7517;-118.227;Ref;xTide_2052;Long Beach, Terminal Island, California;0.0;-0.28433;-0.86490;-1.45433;-1.67920;-0.88945;-0.06976
40.3033;-73.9767;Sub;xTide_2053;Long Branch (fishing pier), New Jersey;0.0;-0.05800;-0.74400;-1.39900;-1.50400;-0.48847;-0.81892
40.325;-73.9967;Sub;xTide_2054;Long Branch Reach, Shrewsbury River, New Jersey;0.0;-999999;-999999;-999999;-999999;-999999;-999999
36.9033;-76.07;Sub;xTide_2055;Long Creek, Lynnhaven Bay, Virginia;0.0;-0.03950;-0.29388;-0.54500;-0.60965;-0.16955;-0.42442
41.275;-73.0883;Sub;xTide_2056;Long Hill, Housatonic River, Connecticut;0.0;-0.07500;-1.06200;-2.16200;-2.26400;-0.75398;-1.08206
43.69;-70.17;Sub;xTide_2057;Long Island, Casco Bay, Maine;0.0;-0.10408;-1.50174;-2.87371;-3.00588;-1.32519;-1.54151
31.9567;-81.06;Sub;xTide_2058;Long Island, NNE of, Skidaway River (Depth 6ft), Wassaw Sound, Georgia Current;0.0;-999999;-999999;-999999;-999999;-999999;-999999
31.9433;-81.0733;Sub;xTide_2059;Long Island, south of, Skidaway River (Depth 10ft), Wassaw Sound, Georgia Current;0.0;-999999;-999999;-999999;-999999;-999999;-999999
24.8283;-80.8083;Sub;xTide_2060;Long Key Bight, Long Key, Florida;0.0;-0.02172;-0.19350;-0.36136;-0.40587;0.02117;-0.45904
24.82;-80.8167;Sub;xTide_2061;Long Key Lake, Long Key, Florida;0.0;-0.02410;-0.11330;-0.20140;-0.24950;0.08572;-0.37906
27.7517;-82.7533;Sub;xTide_2062;Long Key, 0.5mi N. of Corey Causeway, Boca Ciega Bay, Florida;0.0;-0.12053;-0.36664;-0.60376;-0.69806;-0.20084;-0.47675
24.8033;-80.85;Sub;xTide_2063;Long Key, western end, Florida;0.0;-0.04585;-0.25467;-0.40682;-0.45811;-0.06784;-0.52151
41.0383;-73.48;Ref;xTide_2064;Long Neck Point, Long Island Sound, Connecticut;0.0;-0.07111;-1.16200;-2.25388;-2.36186;-0.88235;-1.22190
38.8433;-76.3267;Sub;xTide_2065;Long Point, 1 mile southeast of, Eastern Bay, Maryland Current;0.0;-0.06579;-0.24466;-0.42460;-0.49813;-0.06642;-0.30205
38.0567;-75.8033;Sub;xTide_2066;Long Point, Big Annemessex River, Chesapeake Bay, Maryland;0.0;-0.04100;-0.33770;-0.63435;-0.66739;-0.13750;-0.39171
39.1017;-74.755;Sub;xTide_2067;Long Reach, Ingram Thorofare, Townsends Inlet, New Jersey;0.0;-0.06009;-0.64255;-1.22800;-1.32175;-0.33275;-0.72757
41.4083;-70.3333;Sub;xTide_2068;Long Shoal-Norton Shoal, between, Nantucket Sound, Massachusetts Current;0.0;-0.06917;-0.43850;-0.74864;-0.82672;-0.25833;-0.53024
27.4417;-82.69;Sub;xTide_2069;Longboat Pass, Sarasota Bay, Florida Current;0.0;-0.11510;-0.32667;-0.55128;-0.63994;-0.16162;-0.46427
47.21;-122.753;Sub;xTide_2070;Longbranch, Filucy Bay, Puget Sound, Washington;0.0;-0.88413;-2.34717;-3.84014;-4.11525;-2.17686;-1.13491
39.3083;-74.5333;Ref;xTide_2071;Longport, Risely Channel, New Jersey;0.0;-0.04545;-0.62392;-1.20448;-1.32655;-0.30985;-0.69974
46.1061;-122.9542;Ref;xTide_2072;Longview, Columbia River, Washington;0.0;-0.10591;-0.62769;-1.24633;-1.39743;0.53015;1.50106
48.4797;-122.8187;Sub;xTide_2073;Lopez Pass, Rosario Strait, Washington Current;0.0;-0.66738;-1.42472;-2.16768;-2.34352;-1.27775;-0.12530
30.515;-87.1617;Sub;xTide_2074;Lora Point, Escambia Bay, Pensacola Bay, Florida;0.0;-0.01740;-0.21107;-0.41080;-0.42873;-0.09526;-0.10847
55.6017;-131.632;Sub;xTide_2075;Loring, Naha Bay, Alaska;0.0;-999999;-999999;-999999;-999999;-999999;-999999
33.72;-118.272;Ref;xTide_2076;Los Angeles (outer harbor), California;0.0;-0.28670;-0.86050;-1.44790;-1.67290;-0.80811;-0.06265
33.75;-118.2667;Sub;xTide_2077;Los Angeles Harbor, Mormon Island, California;0.0;-0.29176;-0.85347;-1.43966;-1.65905;-0.83635;-0.05552
33.7167;-118.05;Sub;xTide_2078;Los Patos (highway bridge), California;0.0;-999999;-999999;-999999;-999999;-999999;-999999
6.9;-152.7333;Sub;xTide_2079;Losap Atoll, Chuuk, F.S.M.;0.0;-999999;-999999;-999999;-999999;-999999;-999999
65.39;-167.145;Ref;xTide_2080;Lost River, Seward Peninsula, Alaska;0.0;-999999;-999999;-999999;-999999;-999999;-999999
25.5533;-81.2133;Sub;xTide_2081;Lostmans River entrance, Florida;0.0;-0.18235;-0.70918;-1.23157;-1.30669;-0.50758;-0.93823
60.4617;-147.672;Sub;xTide_2082;Louis Bay, Knight Island, Prince William Sound, Alaska;0.0;-999999;-999999;-999999;-999999;-999999;-999999
18.3607;-64.8035;Ref;xTide_2083;Lovango Cay, St. John, Virgin Islands;0.0;-0.05734;-0.15132;-0.24308;-0.32284;-999999;-0.00542
39.0342;-76.2678;Sub;xTide_2084;Love Point, 1.6 n.mi. east of (Depth 16ft), Chester River, Maryland Current;0.0;-0.06731;-0.24928;-0.42674;-0.51575;-0.06388;-0.30665
39.0797;-76.3122;Sub;xTide_2085;Love Point, 2.5 miles north of, Chesapeake Bay, Maryland Current;0.0;-0.06640;-0.23676;-0.40223;-0.49050;-0.04244;-0.28652
39.0317;-76.3017;Ref;xTide_2086;Love Point, Chester River, Maryland;0.0;-0.06540;-0.24806;-0.42661;-0.51397;-0.06837;-0.30729
39.725;-74.1367;Sub;xTide_2087;Loveladies Harbor, Barnegat Bay, New Jersey;0.0;-0.02093;-0.08659;-0.16601;-0.20234;0.28797;-0.09797
29.6;-85.05;Sub;xTide_2088;Lower Anchorage, Apalachicola Bay, Florida;0.0;-0.15102;-0.30500;-0.49400;-0.54510;-0.14911;-0.31723
30.9783;-87.8733;Ref;xTide_2089;Lower Bryant Landing, Tensay River, Alabama;0.0;-999999;-999999;-999999;-999999;-999999;-999999
38.3417;-76.9767;Sub;xTide_2090;Lower Cedar Point, Potomac River, Maryland;0.0;-0.03333;-0.27728;-0.50629;-0.54399;-0.03332;-0.27968
30.8183;-87.915;Sub;xTide_2091;Lower Hall Landing, Tensaw River, Alabama;0.0;-999999;-999999;-999999;-999999;-999999;-999999
38.655;-76.6833;Ref;xTide_2092;Lower Marlboro, Patuxent River, Maryland;0.0;-0.04747;-0.31888;-0.56632;-0.60207;-0.05512;-0.33906
32.7033;-80.2783;Sub;xTide_2093;Lower Toogoodoo Creek, 2 mi. above entrance, North Edisto River, South Carolina;0.0;-0.07397;-1.29566;-2.12366;-2.23171;-0.99710;-1.28999
33.6083;-79.1517;Sub;xTide_2094;Lower Topsaw Landing, Great Pee Dee River, South Carolina;0.0;-0.03100;-0.20596;-0.32292;-0.34491;0.82001;0.51693
32.4517;-80.61;Sub;xTide_2095;Lucy Point Creek entrance, Morgan River, South Carolina;0.0;-0.06615;-1.18070;-2.10901;-2.21967;-0.93379;-1.21568
39.1767;-74.71;Sub;xTide_2096;Ludlam Bay, west side, Corson Inlet, New Jersey;0.0;-999999;-999999;-999999;-999999;-999999;-999999
41.3217;-72.35;Sub;xTide_2097;Lyme, highway bridge, Connecticut River, Connecticut;0.0;-0.05420;-0.55741;-1.06337;-1.14763;-0.30893;-0.61944
47.4183;-122.9;Sub;xTide_2098;Lynch Cove Dock, Washington;0.0;-0.93300;-2.15800;-3.38300;-3.69100;-1.95995;-0.89364
39.25;-76.4383;Sub;xTide_2099;Lynch Point, Back River, Maryland Current;0.0;-0.06260;-0.24363;-0.40906;-0.50437;0.01630;-0.26239
29.765;-95.0783;Ref;xTide_2100;Lynchburg Landing, San Jacinto River, Galveston Bay, Texas;0.0;-0.05300;-0.24700;-0.42300;-0.45000;-0.00357;-0.00121
